31972	CAM AMS MSG SGD GDG DGG GGS GSQ SQG QGN GNL NLI LIF	CAS ASS SSA SAR ARS RSN SNQ NQP QPQ PQH QHF	GILGFVFTL
35448	CLV LVG VGG GGF GFY FYN YNQ NQG QGG GGK GKL KLI LIF	CSA SAR ART RTS TSG SGG GGD GDS DSN SNE NEQ EQF QFF	KLGGALQAK
34952	CVA VAG AGG GGA GAA AAG AGN GNK NKL KLT LTF	CAS ASS SSP SPR PRD RDS DSP SPF PFE FEQ EQY QYF	KLGGALQAK
35079	CAV AVQ VQT QTG TGA GAN ANN NNL NLF LFF	CAS ASS SSP SPG PGP GPG PGY GYE YEQ EQY QYV	KLGGALQAK
5240	CAE AED EDN DNN NNA NAR ARL RLM LMF	CSA SAR ARD RDE DET ETG TGN GNT NTI TIY IYF	GLCTLVAML
635	CAM AMR MRE REP EPN PNY NYG YGQ GQN QNF NFV FVF	CAS ASS SSV SVG VGQ GQA QAT ATN TNE NEK EKL KLF LFF	RAKFKQLL
29020	CAV AVA VAK AKD KDL DLQ LQN QNS NSG SGG GGG GGA GAD ADG DGL GLT LTF	CAS ASS SSA SAR ARS RSS SSS SSE SEQ EQY QYF	GILGFVFTL
28586	CAV AVR VRY RYG YGN GNN NNR NRL RLA LAF	CAS ASS SSY SYS YSS SSS SSS SSG SGG GGS GSS SSY SYN YNE NEQ EQF QFF	KLGGALQAK
2312	CAL ALS LSR SRN RND NDY DYK YKL KLS LSF	CAT ATS TSR SRE REE EEG EGD GDG DGY GYT YTF	KLGGALQAK
6357	CAG AGG GGG GGS GSQ SQG QGN GNL NLI LIF	CAS ASS SST STR TRS RST STD TDT DTQ TQY QYF	GILGFVFTL
35230	CYE YEE EET ETS TSG SGS GSR SRL RLT LTF	CAS ASS SSL SLF LFI FIG IGG GGY GYN YNE NEQ EQF QFF	KLGGALQAK
33468	CAG AGA GAG AGG GGG GGS GSQ SQG QGN GNL NLI LIF	CAS ASS SSK SKR KRS RST STD TDT DTQ TQY QYF	GILGFVFTL
33595	CAV AVS VSP SPI PID IDM DMD MDS DSN SNY NYQ YQL QLI LIW	CAS ASS SST STH THS HSG SGN GNQ NQP QPQ PQH QHF	GILGFVFTL
35690	CAF AFM FMS MSL SLI LIQ IQG QGA GAQ AQK QKL KLV LVF	CAS ASS SSE SEA EAW AWG WGT GTP TPL PLW LWG WGE GEK EKL KLF LFF	KLGGALQAK
6231	CAW AWS WSS SSN SNA NAG AGG GGT GTS TSY SYG YGK GKL KLT LTF	CAS ASS SSL SLQ LQG QGY GYN YNE NEQ EQF QFF	GILGFVFTL
34953	CAE AEN ENY NYG YGQ GQN QNF NFV FVF	CAS ASS SSQ SQQ QQS QSH SHL HLA LAG AGV GVW VWH WHT HTQ TQY QYF	KLGGALQAK
35106	CAG AGS GSS SSG SGA GAG AGS GSY SYQ YQL QLT LTF	CAS ASS SSL SLA LAR ARV RVY VYT YTE TEA EAF AFF	KLGGALQAK
36087	CAV AVE VEP EPL PLY LYG YGN GNK NKL KLV LVF	CAS ASS SSQ SQE QED EDQ DQS QSS SSY SYN YNE NEQ EQF QFF	KLGGALQAK
23813	CAA AAS ASE SET ETS TSY SYD YDK DKV KVI VIF	CAS ASS SSP SPI PIP IPV PVV VVT VTE TEA EAF AFF	RAKFKQLL
35839	CAE AEN END NDN DNY NYG YGQ GQN QNF NFV FVF	CAS ASS SSI SIE IEG EGA GAH AHE HEE EET ETQ TQY QYF	KLGGALQAK
49	CAV AVE VEV EVN VNA NAG AGN GNN NNR NRK RKL KLI LIW	CAS ASS SSF SFS FSG SGN GNT NTG TGE GEL ELF LFF	GILGFVFTL
9486	CAV AVR VRG RGY GYN YNA NAG AGN GNM NML MLT LTF	CAS ASS SSF SFS FSG SGN GNT NTG TGE GEL ELF LFF	RAKFKQLL
34493	CAA AAV AVL VLD LDT DTG TGR GRR RRA RAL ALT LTF	CAS ASS SSP SPG PGQ GQA QAP APY PYE YEQ EQY QYF	KLGGALQAK
14673	CVV VVI VIL ILT LTT TTD TDS DSW SWG WGK GKF KFQ FQF	CAS ASS SSE SET ETG TGG GGV GVG VGS GSP SPL PLH LHF	KLGGALQAK
35451	CAV AVT VTI TIL ILY LYS YSG SGG GGG GGA GAD ADG DGL GLT LTF	CSA SAR ARV RVG VGL GLG LGT GTE TEA EAF AFF	KLGGALQAK
30095	CAF AFM FMV MVN VNA NAG AGG GGT GTS TSY SYG YGK GKL KLT LTF	CAS ASS SSI SIG IGV GVA VAG AGY GYT YTF	GILGFVFTL
36097	CIL ILS LSR SRQ RQE QEG EGG GGA GAD ADG DGL GLT LTF	CAS ASS SSQ SQS QSG SGT GTY TYN YNS NSP SPL PLH LHF	KLGGALQAK
35136	CAV AVV VVS VSN SNN NNN NND NDM DMR MRF	CAS ASS SSD SDS DSY SYS YSY SYG YGY GYT YTF	KLGGALQAK
24593	CAP APW PWD WDF DFN FNK NKF KFY FYF	CAS ASS SSL SLQ LQG QGG GGT GTG TGE GEL ELF LFF	RAKFKQLL
34211	CAL ALG LGE GEL ELG LGR GRS RSS SSA SAS ASK SKI KII IIF	CAS ASS SSQ SQR QRN RNG NGY GYT YTF	KLGGALQAK
34765	CAV AVK VKA KAA AAG AGN GNK NKL KLT LTF	CAS ASS SSL SLG LGT GTN TNS NSG SGN GNT NTI TIY IYF	KLGGALQAK
17881	CLV LVG VGD GDK DKG KGD GDD DDK DKI KII IIF	CAS ASS SSF SFF FFR FRS RSG SGG GGS GSL SLN LNY NYG YGY GYT YTF	KLGGALQAK
36272	CAV AVD VDL DLM LMK MKT KTS TSY SYD YDK DKV KVI VIF	CSA SAM AMT MTS TSG SGS GSS SSY SYE YEQ EQY QYF	IVTDFSVIK
34878	CAV AVL VLP LPS PSS SSG SGS GSA SAR ARQ RQL QLT LTF	CAS ASS SSD SDG DGD GDS DSP SPY PYN YNE NEQ EQF QFF	KLGGALQAK
34796	CAT ATD TDG DGN GND NDY DYK YKL KLS LSF	CAS ASS SSY SYP YPR PRT RTG TGQ GQG QGA GAQ AQG QGE GET ETQ TQY QYF	KLGGALQAK
2447	CAV AVG VGE GEG EGF GFG FGN GNV NVL VLH LHC	CAS ASS SSL SLR LRG RGA GAS ASA SAG AGY GYT YTF	KLGGALQAK
18	CVV VVN VNR NRA RAG AGN GNN NNR NRK RKL KLI LIW	CAT ATS TSD SDT DTH THQ HQG QGY GYQ YQQ QQF QFF	KLGGALQAK
33989	CAV AVI VID IDS DSQ SQG QGN GNL NLI LIF	CAT ATS TSD SDA DAG AGN GNE NEQ EQF QFF	KLGGALQAK
35412	CAG AGG GGG GGG GGD GDS DSN SNY NYQ YQL QLI LIW	CSA SAR ARD RDG DGV GVS VSP SPQ PQH QHF	KLGGALQAK
33851	CAA AAG AGE GEY EYG YGN GNK NKL KLV LVF	CAS ASS SSV SVR VRS RSS SSY SYE YEQ EQY QYF	GILGFVFTL
35799	CAA AAD ADS DSG SGY GYA YAL ALN LNF	CAS ASN SNW NWS WSP SPG PGI GID IDQ DQP QPQ PQH QHF	KLGGALQAK
7261	CAV AVN VNT NTG TGG GGF GFK FKT KTI TIF	CAS ASS SSQ SQE QEG EGG GGN GNS NSP SPY PYG YGY GYT YTF	KLGGALQAK
169	CVV VVN VNG NGN GNS NSG SGG GGY GYQ YQK QKV KVT VTF	CAS ASS SSD SDL DLA LAG AGD GDP DPT PTD TDT DTQ TQY QYF	GILGFVFTL
26018	CGT GTE TEP EPK PKR KRG RGG GGA GAD ADG DGL GLT LTF	CAS AST STP TPS PSF SFG FGR GRN RNT NTG TGE GEL ELF LFF	KLGGALQAK
97	CVV VVS VSE SEG EGG GGG GGS GSY SYI YIP IPT PTF	CAS ASS SSP SPG PGK GKD KDR DRF RFS FSG SGN GNT NTI TIY IYF	KLGGALQAK
33390	CAV AVR VRD RDG DGT GTG TGA GAN ANN NNL NLF LFF	CAS ASS SSI SIT ITS TST STG TGE GEL ELF LFF	GILGFVFTL
5378	CAA AAS ASA SAP APG PGS GSA SAR ARQ RQL QLT LTF	CAS ASS SSA SAN ANR NRA RAE AET ETQ TQY QYF	KLGGALQAK
25285	CIV IVR VRE REG EGS GSQ SQG QGN GNL NLI LIF	CAS ASS SSE SET ETG TGG GGW GWG WGY GYT YTF	KLGGALQAK
4932	CAV AVR VRD RDV DVV VVS VSG SGS GSA SAR ARQ RQL QLT LTF	CAS ASR SRL RLD LDG DGT GTS TSS SSH SHE HEQ EQY QYF	KLGGALQAK
17178	CAV AVP VPY PYS YSG SGA GAG AGS GSY SYQ YQL QLT LTF	CAS ASS SSG SGS GST STS TSQ SQG QGG GGD GDT DTG TGE GEL ELF LFF	KLGGALQAK
15871	CAL ALN LNN NNN NNA NAR ARL RLM LMF	CAS ASS SST STS TST STG TGT GTG TGY GYG YGY GYT YTF	RAKFKQLL
26481	CAM AME MES ESQ SQK QKL KLL LLF	CSA SAR ARG RGS GSG SGG GGD GDP DPT PTD TDT DTQ TQY QYF	RAKFKQLL
24088	CAM AMR MRG RGD GDS DSG SGG GGG GGA GAD ADG DGL GLT LTF	CAS ASG SGR GRL RLS LSY SYN YNE NEQ EQF QFF	RAKFKQLL
35929	CNA NAG AGN GNM NML MLT LTF	CAS ASS SSS SSG SGA GAG AGG GGT GTD TDT DTQ TQY QYF	KLGGALQAK
7346	CAG AGL GLN LNN NNN NND NDM DMR MRF	CAS ASG SGF GFG FGG GGD GDR DRP RPD PDR DRR RRA RAE AEA EAF AFF	KLGGALQAK
25815	CAA AAS ASE SET ETS TSY SYD YDK DKV KVI VIF	CAS ASS SSS SSL SLG LGT GTA TAK AKS KSP SPL PLH LHF	RAKFKQLL
7358	CAA AAS ASE SET ETS TSY SYD YDK DKV KVI VIF	CAS ASG SGL GLV LVE VES ESA SAG AGT GTE TEA EAF AFF	RAKFKQLL
34626	CAL ALT LTG TGG GGY GYQ YQK QKV KVT VTF	CAS ASS SSL SLE LEG EGQ GQG QGV GVE VET ETQ TQY QYF	KLGGALQAK
5409	CAV AVD VDS DSG SGG GGG GGA GAD ADG DGL GLT LTF	CAS ASS SSS SSP SPA PAN ANE NEG EGT GTD TDT DTQ TQY QYF	ELAGIGILTV
2372	CAV AVT VTS TSV SVG VGN GNK NKL KLT LTF	CAS ASS SSL SLS LSG SGT GTN TNG NGY GYT YTF	ELAGIGILTV
24363	CAV AVT VTP TPG PGG GGG GGA GAD ADG DGL GLT LTF	CAS ASS SSL SLG LGT GTL TLG LGG GGG GGT GTE TEA EAF AFF	KLGGALQAK
34237	CAV AVS VSE SEG EGN GNF NFN FNK NKF KFY FYF	CAS ASS SSQ SQI QIA IAG AGV GVG VGS GSV SVP VPG PGT GTD TDT DTQ TQY QYF	KLGGALQAK
17005	CIL ILR LRD RDL DLN LNA NAG AGG GGT GTS TSY SYG YGK GKL KLT LTF	CAS ASS SSP SPV PVT VTG TGS GSS SSY SYE YEQ EQY QYF	GLCTLVAML
14249	CAE AEN ENL NLG LGD GDS DSS SSY SYK YKL KLI LIF	CAS ASR SRP RPS PSG SGG GGA GAE AET ETQ TQY QYF	KLGGALQAK
25696	CAA AAA AAR ARM RMD MDS DSS SSY SYK YKL KLI LIF	CAS ASS SSL SLV LVS VSN SNE NEQ EQF QFF	RAKFKQLL
22309	CAD ADS DSG SGG GGG GGA GAD ADG DGL GLT LTF	CAS ASS SSL SLT LTE TEG EGG GGR GRN RNQ NQP QPQ PQH QHF	RAKFKQLL
22582	CAG AGG GGG GGS GSQ SQG QGN GNL NLI LIF	CAS ASS SSG SGP GPG PGG GGV GVD VDE DEQ EQY QYF	RAKFKQLL
35844	CVV VVN VNI NIA IAG AGN GNR NRD RDD DDK DKI KII IIF	CAS ASS SSI SIG IGG GGH GHT HTY TYN YNE NEQ EQF QFF	KLGGALQAK
24962	CAT ATD TDG DGR GRS RST STL TLT LTF	CAS ASS SSL SLN LNR NRG RGD GDP DPE PEA EAF AFF	GLCTLVAML
23028	CAA AAK AKE KEG EGY GYS YST STL TLT LTF	CAS ASS SSS SST STG TGG GGG GGE GEK EKD KDQ DQP QPQ PQH QHF	KLGGALQAK
36189	CAL ALR LRR RRG RGA GAG AGN GNM NML MLT LTF	CAT ATQ TQS QSG SGG GGG GGN GNS NSP SPL PLH LHF	KLGGALQAK
32520	CAV AVN VNG NGG GGG GGG GGS GSQ SQG QGN GNL NLI LIF	CAS ASS SSI SIR IRA RAS ASH SHE HEQ EQF QFF	GILGFVFTL
36153	CAV AVM VMD MDS DSN SNY NYQ YQL QLI LIW	CAT ATS TSR SRD RDS DSG SGH GHP HPD PDR DRQ RQY QYF	KLGGALQAK
35932	CAG AGG GGG GGN GNT NTG TGK GKL KLI LIF	CAS ASS SSS SSL SLS LSG SGG GGR GRA RAF AFG FGE GEL ELF LFF	KLGGALQAK
5113	CAA AAS ASK SKA KAS ASG SGT GTY TYK YKY KYI YIF	CAS ASS SSP SPG PGT GTG TGL GLG LGQ GQP QPQ PQH QHF	ELAGIGILTV
34006	CAV AVY VYS YSS SSA SAS ASK SKI KII IIF	CAT ATS TSD SDG DGD GDK DKR KRA RAR ARE RET ETQ TQY QYF	KLGGALQAK
2467	CAA AAE AEG EGS GSF SFQ FQK QKL KLV LVF	CAS ASS SSP SPL PLG LGP GPN PNY NYE YEQ EQY QYF	KLGGALQAK
34335	CAV AVH VHN HNA NAG AGG GGT GTS TSY SYG YGK GKL KLT LTF	CAS ASS SSQ SQG QGV GVG VGQ GQG QGN GNQ NQP QPQ PQH QHF	KLGGALQAK
35213	CAT ATD TDD DDG DGA GAN ANS NSK SKL KLT LTF	CAS ASS SSF SFA FAP APG PGG GGG GGY GYT YTG TGE GEL ELF LFF	KLGGALQAK
32019	CAM AMG MGG GGG GGG GGG GGS GSQ SQG QGN GNL NLI LIF	CAS ASS SSF SFR FRS RSS SSE SET ETQ TQY QYF	GILGFVFTL
14628	CAL ALG LGG GGF GFG FGT GTY TYK YKY KYI YIF	CAS ASA SAP APS PSG SGG GGA GAT ATD TDT DTQ TQY QYF	KLGGALQAK
34792	CAG AGS GSG SGT GTY TYK YKY KYI YIF	CAS ASS SSR SRT RTG TGP GPG PGE GET ETQ TQY QYF	KLGGALQAK
34225	CAE AEA EAG AGG GGG GGA GAD ADG DGL GLT LTF	CAS ASS SSS SSL SLG LGG GGV GVD VDT DTE TEA EAF AFF	KLGGALQAK
5041	CAA AAS ASA SAM AMI MIK IKT KTG TGA GAN ANN NNL NLF LFF	CAS ASS SSD SDI DIL ILA LAG AGV GVG VGE GEQ EQY QYF	KLGGALQAK
373	CVL VLS LSG SGG GGS GSY SYI YIP IPT PTF	CAS ASS SSG SGP GPG PGQ GQL QLS LST STD TDT DTE TEA EAF AFF	KLGGALQAK
18065	CAV AVD VDS DSN SNA NAG AGN GNM NML MLT LTF	CAS ASS SSF SFS FSS SSE SET ETQ TQY QYF	KLGGALQAK
34105	CAV AVY VYS YSG SGG GGG GGA GAD ADG DGL GLT LTF	CAS ASR SRE RER ERE REL ELG LGW GWF WFE FEQ EQF QFF	KLGGALQAK
34652	CAV AVR VRD RDP DPH PHP HPL PLY LYN YNN NNN NND NDM DMR MRF	CAS ASS SSL SLR LRD RDS DSQ SQE QET ETQ TQY QYF	AVFDRKSDAK
7306	CAV AVP VPD PDN DNY NYG YGQ GQN QNF NFV FVF	CAS ASS SSA SAR ARS RSS SSY SYE YEQ EQY QYF	GILGFVFTL
26499	CAL ALS LSV SVF VFS FSG SGG GGG GGA GAD ADG DGL GLT LTF	CSA SAR ARW RWG WGG GGG GGT GTD TDT DTQ TQY QYF	KLGGALQAK
34017	CAV AVI VIP IPT PTH THG HGS GSS SSN SNT NTG TGK GKL KLI LIF	CAT ATS TSE SEF EFD FDR DRD RDG DGE GET ETQ TQY QYF	KLGGALQAK
6356	CAG AGA GAN ANT NTN TNA NAG AGK GKS KST STF	CAS ASS SST STR TRS RSS SSY SYE YEQ EQY QYF	GILGFVFTL
11838	CAG AGA GAE AET ETS TSY SYD YDK DKV KVI VIF	CAS ASS SSF SFS FSG SGN GNT NTG TGE GEL ELF LFF	RAKFKQLL
18070	CAA AAS ASE SET ETS TSY SYD YDK DKV KVI VIF	CAS ASS SSL SLY LYS YSA SAT ATG TGE GEL ELF LFF	RAKFKQLL
35269	CAA AAS ASA SAG AGE GES ESG SGG GGS GSY SYI YIP IPT PTF	CAS ASS SSS SSP SPL PLP LPG PGT GTG TGV GVN VNE NEQ EQF QFF	KLGGALQAK
28825	CAA AAP APY PYG YGG GGS GSQ SQG QGN GNL NLI LIF	CAS ASS SSY SYP YPG PGT GTG TGT GTS TSN SNQ NQP QPQ PQH QHF	GILGFVFTL
34528	CAV AVR VRF RFW FWG WGS GSQ SQG QGN GNL NLI LIF	CAS ASS SSS SST STG TGL GLG LGE GEG EGI GIY IYE YEQ EQY QYV	KLGGALQAK
14317	CAV AVM VMW MWD WDS DSG SGG GGS GSN SNY NYK YKL KLT LTF	CAS ASS SST STV TVG VGA GAL ALY LYN YNE NEQ EQF QFF	KLGGALQAK
25005	CAE AER ERK RKD KDD DDY DYK YKL KLS LSF	CAS ASS SSW SWG WGG GGG GGS GSH SHY HYG YGY GYT YTF	IVTDFSVIK
35432	CAV AVS VSG SGR GRG RGA GAG AGF GFG FGN GNV NVL VLH LHC	CSA SAR ARD RDP DPG PGQ GQG QGY GYE YEQ EQY QYF	KLGGALQAK
14190	CAE AET ETQ TQD QDS DSN SNY NYQ YQL QLI LIW	CAS ASS SSS SSS SSS SST STG TGE GEL ELF LFF	RAKFKQLL
33483	CAA AAW AWS WSP SPE PEY EYS YST STL TLT LTF	CAS ASS SSM SMI MIG IGE GET ETQ TQY QYF	GILGFVFTL
6332	CAL ALG LGE GED EDA DAG AGG GGT GTS TSY SYG YGK GKL KLT LTF	CAS ASS SST STG TGT GTP TPI PIR IRH RHF	GILGFVFTL
35952	CAL ALS LSE SEN ENA NAG AGT GTY TYK YKY KYI YIF	CAS AST STP TPG PGQ GQG QGA GAG AGE GEL ELF LFF	KLGGALQAK
3233	CAV AVP VPA PAG AGG GGN GNT NTP TPL PLV LVF	CAS ASS SSW SWG WGG GGG GGS GSH SHY HYG YGY GYT YTF	IVTDFSVIK
34222	CVV VVV VVS VSG SGN GNT NTP TPL PLV LVF	CAS ASS SSQ SQV QVW VWS WSG SGE GEY EYG YGY GYT YTF	KLGGALQAK
2253	CAG AGH GHT HTG TGN GNQ NQF QFY FYF	CAS ASS SSL SLR LRD RDG DGS GSE SEA EAF AFF	IVTDFSVIK
472	CAV AVA VAL ALS LSG SGY GYS YST STL TLT LTF	CAS ASS SSL SLS LSS SSG SGT GTY TYE YEQ EQY QYF	IVTDFSVIK
30087	CVV VVN VNG NGY GYS YST STL TLT LTF	CAS ASS SSI SIG IGR GRN RNT NTE TEA EAF AFF	KLGGALQAK
15667	CAV AVD VDT DTP TPN PNT NTG TGN GNQ NQF QFY FYF	CAS ASS SST STS TST STG TGT GTG TGY GYG YGY GYT YTF	RAKFKQLL
35631	CAF AFM FMT MTG TGE GEQ EQG QGG GGS GSE SEK EKL KLV LVF	CAS ASS SSL SLS LSG SGS GST STD TDT DTQ TQY QYF	KLGGALQAK
35574	CAV AVR VRP RPG PGY GYN YNF NFN FNK NKF KFY FYF	CSV SVR VRD RDS DSQ SQN QNT NTE TEA EAF AFF	KLGGALQAK
10407	CVV VVY VYY YYG YGG GGK GKL KLI LIF	CAS ASS SSF SFS FSG SGN GNT NTG TGE GEL ELF LFF	RAKFKQLL
35302	CAV AVI VIW IWQ WQG QGG GGS GSE SEK EKL KLV LVF	CAS ASS SSP SPP PPR PRG RGY GYE YEQ EQY QYF	KLGGALQAK
33588	CAY AYR YRV RVG VGG GGG GGS GSW SWG WGK GKT KTQ TQG QGG GGS GSE SEK EKL KLV LVF	CAS ASS SSS SSS SSG SGG GGA GAG AGE GEL ELF LFF	GILGFVFTL
2384	CAV AVN VNL NLA LAG AGG GGT GTS TSY SYG YGK GKL KLT LTF	CAS ASS SSP SPG PGL GLG LGN GNT NTI TIY IYF	ELAGIGILTV
15987	CAA AAS ASS SSS SSG SGG GGA GAT ATN TNK NKL KLI LIF	CAS ASS SSG SGG GGG GGY GYE YEQ EQY QYF	KLGGALQAK
24989	CAV AVI VIE IES ESN SNY NYQ YQL QLI LIW	CAS ASS SSR SRL RLA LAT ATT TTD TDT DTQ TQY QYF	KLGGALQAK
7206	CAG AGG GGY GYA YAL ALN LNF	CAS ASS SST STR TRS RSS SSY SYE YEQ EQY QYF	GILGFVFTL
35442	CAA AAT ATQ TQG QGG GGS GSE SEK EKL KLV LVF	CSA SAR ARL RLD LDR DRA RAG AGE GET ETQ TQY QYF	KLGGALQAK
5647	CAV AVS VSD SDQ DQI QIS ISG SGN GNE NEK EKL KLT LTF	CAS ASS SSI SIH IHK HKN KNQ NQP QPQ PQH QHF	GILGFVFTL
15583	CAY AYR YRS RSA SAR ARE RET ETG TGN GNQ NQF QFY FYF	CAS ASS SSR SRS RSL SLH LHS HSN SNQ NQP QPQ PQH QHF	RAKFKQLL
34013	CVV VVK VKN KNQ NQG QGN GND NDM DMR MRF	CAT ATS TSD SDP DPQ PQT QTG TGG GGF GFD FDE DEQ EQF QFF	KLGGALQAK
30415	CIV IVR VRV RVE VEG EGI GIS ISN SNA NAG AGN GNM NML MLT LTF	CAS ASS SSI SIR IRA RAS ASY SYE YEQ EQY QYF	GILGFVFTL
7355	CAD ADS DSG SGG GGG GGA GAD ADG DGL GLT LTF	CAS ASA SAP APD PDG DGF GFF FFY FYG YGY GYT YTF	RAKFKQLL
2283	CAV AVR VRD RDI DIA IAS ASG SGT GTY TYK YKY KYI YIF	CAS ASS SSL SLG LGG GGR GRG RGV GVT VTD TDT DTQ TQY QYF	KLGGALQAK
30892	CAE AEN ENM NMS MSG SGG GGS GSQ SQG QGN GNL NLI LIF	CAS ASS SSI SIR IRS RSS SSY SYE YEQ EQY QYF	GILGFVFTL
15277	CAE AES ESE SEG EGP GPT PTY TYT YTD TDK DKL KLI LIF	CAS ASS SSL SLL LLW LWA WAE AEY EYN YNE NEQ EQF QFF	RAKFKQLL
24238	CAF AFM FMK MKD KDY DYS YSG SGN GNT NTP TPL PLV LVF	CAS ASS SSL SLA LAL ALI LIL ILT LTE TET ETE TEA EAF AFF	KLGGALQAK
32606	CAE AEN ENK NKG KGG GGG GGS GSQ SQG QGN GNL NLI LIF	CAS ASS SSI SIR IRS RSS SSG SGE GEL ELF LFF	GILGFVFTL
641	CAV AVN VNP NPG PGW GWG WGG GGS GSN SNY NYK YKL KLT LTF	CAS ASS SSV SVT VTG TGQ GQL QLQ LQE QET ETQ TQY QYF	ELAGIGILTV
2452	CAE AEG EGG GGN GNT NTG TGK GKL KLI LIF	CAS ASS SSP SPG PGG GGL GLA LAG AGA GAD ADT DTQ TQY QYF	KLGGALQAK
14979	CAA AAS ASN SNT NTG TGK GKL KLI LIF	CAS ASS SSL SLL LLA LAG AGE GEY EYN YNE NEQ EQF QFF	RAKFKQLL
17890	CAA AAK AKE KEG EGY GYS YST STL TLT LTF	CAS ASS SSP SPG PGT GTE TES EST STD TDT DTQ TQY QYF	KLGGALQAK
30778	CAE AEN ENK NKR KRE REA EAG AGN GNT NTP TPL PLV LVF	CAS ASS SSI SIR IRS RSS SSY SYE YEQ EQY QYF	GILGFVFTL
35397	CVV VVI VIK IKF KFE FET ETS TSG SGT GTY TYK YKY KYI YIF	CSA SAA AAG AGQ GQA QAN ANT NTG TGE GEL ELF LFF	KLGGALQAK
34904	CAV AVK VKD KDY DYK YKL KLS LSF	CAS ASS SSL SLG LGQ GQG QGY GYE YEQ EQY QYF	KLGGALQAK
5170	CAE AED EDN DNN NNA NAR ARL RLM LMF	CSA SAR ARD RDR DRT RTG TGN GNG NGY GYT YTF	GLCTLVAML
32323	CAM AMS MSG SGD GDG DGG GGS GSQ SQG QGN GNL NLI LIF	CAS ASS SSH SHR HRS RSN SNQ NQP QPQ PQH QHF	GILGFVFTL
35014	CAG AGR GRG RGS GSN SNY NYK YKL KLT LTF	CAS ASR SRY RYT YTG TGN GNT NTE TEA EAF AFF	KLGGALQAK
35657	CAL ALM LMN MNY NYG YGG GGS GSQ SQG QGN GNL NLI LIF	CAS ASS SSY SYS YSG SGQ GQG QGY GYN YNE NEQ EQF QFF	KLGGALQAK
223	CAM AMR MRE REG EGL GLG LGT GTG TGR GRR RRA RAL ALT LTF	CAS ASS SSQ SQE QEV EVS VSS SSG SGG GGS GSN SNE NEQ EQF QFF	AVFDRKSDAK
35981	CAL ALK LKA KAA AAG AGN GNK NKL KLT LTF	CAS ASR SRD RDG DGT GTA TAN ANT NTE TEA EAF AFF	KLGGALQAK
35146	CAL ALS LSE SED EDM DMD MDS DSS SSY SYK YKL KLI LIF	CAS ASS SSH SHT HTS TSG SGV GVY VYN YNE NEQ EQF QFF	KLGGALQAK
30923	CAM AMR MRS RST STG TGN GNQ NQF QFY FYF	CAS ASS SSI SIR IRS RSS SSY SYE YEQ EQY QYF	GILGFVFTL
2421	CAL ALS LSD SDV DVE VEY EYG YGN GNK NKL KLV LVF	CAS ASS SSL SLD LDG DGS GSN SNQ NQP QPQ PQH QHF	KLGGALQAK
17090	CGT GTP TPG PGE GEY EYG YGN GNK NKL KLV LVF	CAS ASS SSY SYS YSG SGG GGA GAG AGE GEL ELF LFF	RAKFKQLL
25438	CAA AAG AGE GET ETS TSY SYD YDK DKV KVI VIF	CAS ASS SSL SLL LLG LGG GGG GGP GPN PNS NSP SPL PLH LHF	RAKFKQLL
25812	CAA AAS ASE SET ETS TSY SYD YDK DKV KVI VIF	CAS ASS SSS SSL SLG LGG GGG GGN GNT NTE TEA EAF AFF	RAKFKQLL
36158	CAG AGP GPD PDS DSG SGT GTY TYK YKY KYI YIF	CAS ASR SRD RDG DGY GYY YYG YGY GYT YTF	KLGGALQAK
34418	CAM AMR MRE REG EGP GPG PGG GGF GFK FKT KTI TIF	CAS ASS SSV SVK VKD KDS DSP SPE PEK EKL KLF LFF	KLGGALQAK
13207	CAV AVM VMK MKD KDP DPN PNA NAG AGG GGT GTS TSY SYG YGK GKL KLT LTF	CAS ASS SSF SFS FSG SGN GNT NTG TGE GEL ELF LFF	RAKFKQLL
32290	CGQ GQT QTF	CAS ASS SSG SGR GRS RST STD TDT DTQ TQY QYF	GILGFVFTL
34110	CAV AVN VNW NWG WGG GGS GSE SEK EKL KLV LVF	CAS ASS SSD SDG DGG GGG GGA GAT ATD TDT DTQ TQY QYF	KLGGALQAK
32364	CAA AAS ASP SPN PNA NAG AGG GGT GTS TSY SYG YGK GKL KLT LTF	CAS ASS SSI SIG IGL GLY LYG YGY GYT YTF	GILGFVFTL
5421	CAV AVV VVL VLD LDG DGS GSS SSN SNT NTG TGK GKL KLI LIF	CAS ASS SSY SYG YGQ GQG QGT GTG TGE GEL ELF LFF	KLGGALQAK
34995	CAP APT PTN TNT NTN TNA NAG AGK GKS KST STF	CAS ASS SSP SPG PGQ GQG QGT GTH THT HTP TPP PPN PNE NEQ EQF QFF	KLGGALQAK
5561	CAN ANT NTG TGS GSQ SQG QGN GNL NLI LIF	CAS ASS SSD SDR DRS RSG SGT GTE TEQ EQY QYF	GILGFVFTL
6245	CAT ATV TVP VPS PSN SNT NTG TGK GKL KLI LIF	CAS ASS SSM SMR MRS RSG SGA GAN ANV NVL VLT LTF	GILGFVFTL
34830	CVA VAT ATE TEY EYG YGN GNK NKL KLV LVF	CAS ASS SSL SLG LGV GVE VEG EGN GNS NSN SNQ NQP QPQ PQH QHF	KLGGALQAK
34536	CAV AVN VNP NPE PEP EPG PGN GNF NFG FGN GNE NEK EKL KLT LTF	CAS ASS SSF SFW FWD WDF DFR FRT RTG TGE GEL ELF LFF	KLGGALQAK
36247	CAV AVN VNR NRN RNG NGG GGG GGN GNK NKL KLT LTF	CAS ASS SSS SSR SRD RDR DRG RGY GYE YEQ EQY QYF	KLGGALQAK
18089	CAV AVH VHG HGY GYG YGQ GQN QNF NFV FVF	CAS ASS SST STD TDR DRA RAA AAQ AQP QPQ PQH QHF	KLGGALQAK
5494	CAA AAH AHR HRD RDT DTG TGN GNQ NQF QFY FYF	CAS AST STT TTP TPA PAD ADG DGL GLS LSG SGT GTS TSG SGS GSS SSY SYE YEQ EQY QYF	KLGGALQAK
24041	CAV AVE VED EDY DYN YNK NKF KFY FYF	CAS ASG SGR GRL RLS LSY SYN YNE NEQ EQF QFF	RAKFKQLL
35706	CAL ALS LSE SEP EPG PGA GAN ANN NNL NLF LFF	CAS ASS SSV SVR VRD RDS DSF SFY FYE YEQ EQY QYV	KLGGALQAK
25021	CIL ILR LRE RET ETS TSY SYD YDK DKV KVI VIF	CAS ASS SSL SLG LGV GVA VAG AGT GTN TNT NTG TGE GEL ELF LFF	RAKFKQLL
2931	CAF AFM FMN MNS NSG SGA GAG AGS GSY SYQ YQL QLT LTF	CAS ASS SSW SWG WGG GGG GGS GSH SHY HYG YGY GYT YTF	IVTDFSVIK
279	CAV AVR VRE RER ERD RDY DYK YKL KLS LSF	CAS ASS SSA SAM AMD MDR DRG RGA GAD ADG DGY GYT YTF	KLGGALQAK
34252	CAF AFI FIG IGD GDA DAG AGG GGT GTS TSY SYG YGK GKL KLT LTF	CAS ASS SSQ SQD QDH DHR HRM RMG MGG GGH GHE HEK EKL KLF LFF	KLGGALQAK
35317	CAL ALS LSE SEA EAW AWR WRS RSQ SQG QGN GNL NLI LIF	CAW AWA WAT ATG TGT GTG TGG GGS GSG SGY GYE YEQ EQF QFF	KLGGALQAK
34440	CAG AGI GIT ITG TGG GGG GGN GNK NKL KLT LTF	CAS ASS SSL SLY LYF YFY FYS YSE SEQ EQY QYV	KLGGALQAK
23119	CAV AVL VLP LPM PMD MDS DSS SSY SYK YKL KLI LIF	CAS ASS SSV SVQ VQG QGL GLG LGN GNS NSP SPL PLH LHF	KLGGALQAK
34790	CAT ATV TVD VDN DNS NSG SGG GGS GSN SNY NYK YKL KLT LTF	CAS ASS SSQ SQG QGN GNE NEQ EQF QFF	KLGGALQAK
33963	CAE AEN ENP NPG PGT GTS TSG SGT GTY TYK YKY KYI YIF	CAS ASN SNR NRG RGG GGT GTG TGE GEL ELF LFF	KLGGALQAK
2301	CAV AVK VKG KGS GST STF	CAT ATS TSG SGS GSS SSG SGT GTE TEA EAF AFF	ELAGIGILTV
33854	CAG AGT GTH THG HGG GGS GSQ SQG QGN GNL NLI LIF	CAS ASS SSV SVR VRS RST STD TDT DTQ TQY QYF	GILGFVFTL
36021	CAG AGA GAG AGY GYW YWG WGQ GQN QNF NFV FVF	CAS ASS SSQ SQV QVP VPG PGQ GQG QGP GPN PNY NYG YGY GYT YTF	KLGGALQAK
36237	CAA AAI AIR IRS RSA SAS ASK SKI KII IIF	CAS ASS SSL SLG LGQ GQT QTG TGS GSY SYE YEQ EQY QYF	AVFDRKSDAK
36317	CAV AVN VNW NWE WEE EEQ EQG QGG GGS GSY SYI YIP IPT PTF	CAS ASS SST STP TPG PGQ GQG QGA GAG AGE GEQ EQF QFF	KLGGALQAK
26468	CPL PLP LPT PTN TNA NAG AGK GKS KST STF	CSA SAR ARD RDY DYR YRT RTG TGD GDE DEK EKL KLF LFF	KLGGALQAK
35465	CAE AES ESG SGA GAT ATN TNK NKL KLI LIF	CSA SAW AWD WDR DRL RLN LNT NTE TEA EAF AFF	KLGGALQAK
34834	CAS ASI SIN IND NDY DYK YKL KLS LSF	CAS ASS SSL SLS LSG SGT GTG TGE GEL ELF LFF	KLGGALQAK
35234	CAV AVR VRD RDT DTG TGG GGG GGS GSY SYI YIP IPT PTF	CAS ASS SSL SLL LLR LRD RDI DIP IPP PPG PGE GEL ELF LFF	KLGGALQAK
16058	CAG AGG GGG GGS GSQ SQG QGN GNL NLI LIF	CAS ASS SSQ SQR QRP RPS PSE SEV EVG VGE GEL ELF LFF	RAKFKQLL
36138	CAE AEI EIP IPS PSG SGA GAG AGS GSY SYQ YQL QLT LTF	CAS ASS SSP SPG PGQ GQG QGP GPY PYE YEQ EQY QYF	KLGGALQAK
5491	CIL ILR LRD RDG DGD GDD DDK DKI KII IIF	CAS ASS SSY SYG YGG GGE GEN ENN NNS NSP SPL PLH LHF	KLGGALQAK
34927	CAV AVR VRK RKG KGG GGG GGA GAD ADG DGL GLT LTF	CAI AIN INL NLG LGG GGT GTN TNT NTG TGE GEL ELF LFF	KLGGALQAK
2336	CAA AAS ASP SPF PFS FSY SYN YNT NTD TDK DKL KLI LIF	CAS ASS SSF SFG FGQ GQL QLH LHI HIE IEY EYF	KLGGALQAK
25076	CAL ALS LSE SEA EAT ATG TGN GNQ NQF QFY FYF	CAS ASS SSL SLG LGM GMR MRG RGG GGW GWD WDE DEQ EQF QFF	KLGGALQAK
34198	CAV AVN VNL NLG LGN GNS NSG SGY GYA YAL ALN LNF	CAS ASS SSQ SQG QGR GRL RLR LRT RTE TEA EAF AFF	KLGGALQAK
34538	CLV LVG VGD GDA DAY AYS YSG SGA GAG AGS GSY SYQ YQL QLT LTF	CAS ASS SSG SGE GET ETY TYE YEQ EQY QYF	KLGGALQAK
34062	CAV AVG VGA GAR ARS RSG SGT GTY TYK YKY KYI YIF	CAS ASS SSL SLI LIL ILT LTD TDG DGT GTD TDT DTQ TQY QYF	KLGGALQAK
15145	CAF AFT FTS TSD SDS DSN SNY NYQ YQL QLI LIW	CAS ASS SSL SLL LLW LWA WAE AEY EYN YNE NEQ EQF QFF	RAKFKQLL
18093	CAA AAL ALE LET ETS TSY SYD YDK DKV KVI VIF	CAS AST STR TRQ RQG QGA GAN ANE NEK EKL KLF LFF	RAKFKQLL
36331	CAP APS PSN SNT NTG TGN GNQ NQF QFY FYF	CAS ASS SSR SRG RGA GAL ALP LPV PVD VDE DEQ EQY QYF	KLGGALQAK
36191	CAV AVR VRG RGL GLG LGG GGS GSQ SQG QGN GNL NLI LIF	CAS ASS SSL SLV LVG VGE GEQ EQF QFF	KLGGALQAK
7318	CAG AGE GEG EGG GGG GGS GSQ SQG QGN GNL NLI LIF	CAS ASS SSI SIR IRS RSS SSY SYE YEQ EQY QYF	GILGFVFTL
33475	CVV VVN VNR NRD RDY DYQ YQL QLI LIW	CAS ASS SSL SLT LTS TSP SPG PGN GNT NTI TIY IYF	KLGGALQAK
32525	CAG AGA GAA AAG AGS GSS SSN SNT NTG TGK GKL KLI LIF	CAS ASS SSI SIR IRS RSA SAY AYE YEQ EQY QYF	GILGFVFTL
34114	CAE AEI EIR IRG RGR GRD RDQ DQF QFY FYF	CAS ASS SSD SDR DRM RMN MNT NTE TEA EAF AFF	KLGGALQAK
18026	CAD ADS DSG SGG GGG GGA GAD ADG DGL GLT LTF	CAS ASS SSV SVR VRS RSS SSM SMN MNT NTE TEA EAF AFF	RAKFKQLL
28596	CAV AVM VMD MDS DSN SNY NYQ YQL QLI LIW	CAS ASL SLL LLG LGT GTG TGG GGY GYE YEQ EQY QYF	KLGGALQAK
5220	CAD ADS DSG SGG GGG GGA GAD ADG DGL GLT LTF	CSA SAT ATL TLT LTS TSG SGG GGI GIY IYE YEQ EQY QYF	RAKFKQLL
32775	CAE AEN ENG NGG GGG GGG GGA GAD ADG DGL GLT LTF	CAS ASS SSI SIR IRS RSS SSY SYE YEQ EQY QYF	GILGFVFTL
26150	CAY AYR YRV RVD VDD DDM DMR MRF	CSA SAP APR PRG RGS GSP SPT PTN TNE NEK EKL KLF LFF	RAKFKQLL
34803	CAV AVE VEL ELA LAG AGS GSN SNY NYQ YQL QLI LIW	CAS ASH SHS HSG SGT GTG TGE GEE EEQ EQY QYF	KLGGALQAK
26116	CAV AVA VAK AKD KDL DLQ LQN QNS NSG SGG GGG GGA GAD ADG DGL GLT LTF	CSA SAE AEW EWD WDR DRA RAY AYN YNE NEQ EQF QFF	GILGFVFTL
34640	CSP SPS PSR SRG RGA GAG AGN GNM NML MLT LTF	CAS ASS SSL SLK LKG KGN GNY NYG YGY GYT YTF	KLGGALQAK
29	CAV AVP VPS PSG SGG GGY GYN YNK NKL KLI LIF	CAS ASG SGL GLD LDS DSS SSS SSG SGN GNT NTI TIY IYF	KLGGALQAK
32519	CAL ALA LAP APE PEG EGQ GQK QKL KLL LLF	CAS ASS SSI SIR IRA RAS ASH SHE HEQ EQF QFF	GILGFVFTL
27098	CAV AVR VRM RMD MDS DSS SSY SYK YKL KLI LIF	CSV SVG VGA GAG AGE GEG EGE GEQ EQF QFF	RAKFKQLL
35895	CAV AVS VSG SGG GGG GGA GAD ADG DGL GLT LTF	CAS ASS SSL SLG LGR GRA RAY AYG YGY GYT YTF	KLGGALQAK
23893	CAA AAS ASM SMD MDS DSN SNY NYQ YQL QLI LIW	CAS ASS SSL SLG LGY GYG YGG GGA GAG AGE GET ETQ TQY QYF	KLGGALQAK
2565	CLL LLR LRT RTG TGA GAN ANS NSK SKL KLT LTF	CAS ASS SSL SLG LGT GTS TSG SGM GMG MGE GEQ EQY QYF	KLGGALQAK
1588	CAA AAS ASE SET ETS TSY SYD YDK DKV KVI VIF	CAS ASS SSL SLY LYS YSA SAT ATG TGE GEL ELF LFF	AVFDRKSDAK
34301	CAE AES ESM SMY MYS YSG SGG GGG GGA GAD ADG DGL GLT LTF	CAS ASS SSP SPI PIP IPG PGG GGS GSD SDT DTQ TQY QYF	KLGGALQAK
25028	CAE AEN END NDH DHN HNN NNN NND NDM DMR MRF	CAS ASS SSL SLV LVG VGS GSA SAS ASG SGY GYN YNS NSP SPL PLH LHF	GILGFVFTL
36126	CAM AMR MRE REE EEF EFG FGG GGT GTG TGA GAN ANS NSK SKL KLT LTF	CAS ASS SSL SLG LGL GLG LGG GGD GDT DTQ TQY QYF	KLGGALQAK
34460	CAM AMR MRE REG EGP GPN PNN NNF NFN FNK NKF KFY FYF	CAS ASS SSA SAS ASD SDN DNL NLD LDN DNE NEQ EQF QFF	KLGGALQAK
35743	CAV AVR VRR RRS RSN SND NDY DYK YKL KLS LSF	CAS AST STP TPL PLR LRL RLM LMN MNT NTG TGE GEL ELF LFF	KLGGALQAK
24638	CIV IVR VRD RDM DME MEY EYG YGN GNK NKL KLV LVF	CAS ASS SSL SLV LVV VVA VAG AGG GGP GPG PGT GTD TDT DTQ TQY QYF	RAKFKQLL
25218	CAE AER ERG RGG GGG GGS GST STL TLG LGR GRL RLY LYF	CAS ASS SSL SLG LGV GVA VAG AGT GTN TNT NTG TGE GEL ELF LFF	KLGGALQAK
5033	CAG AGA GAE AEY EYG YGQ GQN QNF NFV FVF	CAS ASR SRE REG EGG GGG GGG GGT GTE TEA EAF AFF	KLGGALQAK
18532	CAG AGA GAS ASG SGS GSS SSN SNT NTG TGK GKL KLI LIF	CAS ASS SSL SLR LRD RDG DGS GSE SEA EAF AFF	RAKFKQLL
35161	CAL ALS LSD SDT DTS TSG SGN GNT NTP TPL PLV LVF	CAS ASS SSL SLG LGT GTG TGG GGY GYN YNE NEQ EQF QFF	KLGGALQAK
35877	CAA AAL ALG LGQ GQN QNF NFV FVF	CAS ASS SSI SIS ISG SGT GTG TGG GGF GFY FYE YEQ EQF QFF	KLGGALQAK
22322	CVV VVS VSD SDI DIY IYN YNN NNA NAG AGN GNM NML MLT LTF	CAS ASS SSR SRF RFR FRD RDS DST STN TNE NEQ EQF QFF	KLGGALQAK
4786	CAV AVR VRD RDG DGG GGS GSG SGY GYS YST STL TLT LTF	CAS ASS SSW SWG WGG GGG GGS GSH SHY HYG YGY GYT YTF	IVTDFSVIK
5058	CAA AAP APY PYT YTP TPG PGG GGA GAT ATN TNK NKL KLI LIF	CAS ASS SSL SLC LCC CCS CSP SPN PNT NTG TGE GEL ELF LFF	KLGGALQAK
2339	CAT ATD TDA DAG AGA GAR ARQ RQG QGG GGS GSE SEK EKL KLV LVF	CAS ASS SSF SFL FLA LAG AGQ GQE QET ETQ TQY QYF	AVFDRKSDAK
