4968	CAG AGG GGN GNT NTG TGK GKL KLI LIF	CAS ASS SSL SLG LGQ GQG QGA GAS ASQ SQP QPQ PQH QHF	KLGGALQAK
34919	CAV AVQ VQA QAY AYR YRD RDN DNY NYG YGQ GQN QNF NFV FVF	CAI AIS ISE SES ESN SNS NSN SNT NTG TGE GEL ELF LFF	KLGGALQAK
35748	CAV AVG VGV GVL VLR LRG RGQ GQA QAG AGT GTA TAL ALI LIF	CAS ASR SRP RPG PGR GRA RAD ADY DYG YGY GYT YTF	KLGGALQAK
33840	CAE AEN ENM NMG MGG GGG GGS GSQ SQG QGN GNL NLI LIF	CAS ASS SSV SVR VRS RSG SGE GET ETQ TQY QYF	GILGFVFTL
33945	CAG AGA GAG AGS GSQ SQG QGN GNL NLI LIF	CAS ASS SSQ SQD QDR DRV RVR VRE RET ETQ TQY QYF	GILGFVFTL
33554	CAG AGA GAG AGS GSQ SQG QGN GNL NLI LIF	CAS ASS SSS SSR SRS RSA SAY AYE YEQ EQY QYF	GILGFVFTL
34621	CAL ALM LME MEY EYG YGN GNK NKL KLV LVF	CAS ASS SSH SHG HGW GWL WLA LAG AGG GGE GED EDT DTQ TQY QYF	KLGGALQAK
25385	CAR ARG RGG GGG GGF GFK FKT KTI TIF	CAS ASS SSL SLA LAD ADV DVG VGG GGP GPQ PQH QHF	RAKFKQLL
35484	CAG AGV GVV VVT VTN TND NDY DYK YKL KLS LSF	CSV SVA VAG AGT GTG TGN GNT NTE TEA EAF AFF	KLGGALQAK
34633	CAR ARK RKY KYK YKL KLS LSF	CAS ASS SSL SLG LGG GGR GRN RNN NNE NEQ EQF QFF	KLGGALQAK
26548	CAV AVN VNQ NQA QAG AGT GTA TAL ALI LIF	CSG SGL GLA LAG AGG GGP GPG PGE GEQ EQY QYF	KLGGALQAK
6686	CAG AGN GNY NYG YGG GGS GSQ SQG QGN GNL NLI LIF	CAS ASS SSI SIR IRS RSD SDE DEK EKL KLF LFF	GILGFVFTL
35909	CAY AYR YRE REN END NDM DMR MRF	CAS ASS SSM SMV MVA VAG AGV GVY VYN YNE NEQ EQF QFF	KLGGALQAK
16650	CVV VVN VNM NMD MDN DNA NAR ARL RLM LMF	CAS ASS SSQ SQR QRP RPS PSE SEV EVG VGE GEL ELF LFF	RAKFKQLL
34074	CAV AVE VEN ENN NNA NAG AGK GKS KST STF	CAS ASS SSY SYP YPM PMG MGG GGA GAD ADG DGS GSQ SQE QET ETQ TQY QYF	KLGGALQAK
34722	CAV AVR VRD RDG DGA GAA AAG AGN GNK NKL KLT LTF	CAS ASS SSG SGG GGT GTS TSG SGS GSN SNE NEQ EQF QFF	KLGGALQAK
35467	CAM AMS MSV SVF VFY FYN YNQ NQG QGG GGK GKL KLI LIF	CSS SSP SPG PGG GGP GPN PNE NEK EKL KLF LFF	KLGGALQAK
35168	CAV AVQ VQP QPQ PQI QIQ IQG QGA GAQ AQK QKL KLV LVF	CAS ASS SSL SLS LSY SYN YNE NEQ EQF QFF	KLGGALQAK
32417	CAE AER ERD RDG DGG GGG GGS GSQ SQG QGN GNL NLI LIF	CAS ASS SSI SIR IRA RAA AAE AET ETQ TQY QYF	GILGFVFTL
18087	CAL ALS LSE SEG EGT GTY TYK YKY KYI YIF	CAS ASS SSS SSR SRG RGR GRR RRD RDP DPG PGE GEL ELF LFF	KLGGALQAK
2347	CAV AVS VST STG TGF GFQ FQK QKL KLV LVF	CAS ASS SSL SLG LGE GET ETQ TQY QYF	ELAGIGILTV
12507	CAL ALL LLI LIY IYG YGG GGY GYQ YQK QKV KVT VTF	CAS ASS SSF SFS FSG SGN GNT NTG TGE GEL ELF LFF	RAKFKQLL
35470	CAV AVL VLG LGG GGG GGA GAD ADG DGL GLT LTF	CSF SFR FRI RIG IGG GGT GTE TEA EAF AFF	KLGGALQAK
35808	CAT ATD TDE DEV EVY VYN YNN NND NDM DMR MRF	CAS ASR SRV RVG VGN GNT NTE TEA EAF AFF	KLGGALQAK
16765	CAE AEN ENP NPS PSS SSA SAS ASK SKI KII IIF	CAS ASS SSQ SQR QRP RPS PSE SEV EVG VGE GEL ELF LFF	RAKFKQLL
35658	CAA AAF AFS FSG SGG GGY GYN YNK NKL KLI LIF	CAS ASS SSY SYS YSG SGS GSD SDT DTQ TQY QYF	KLGGALQAK
28595	CVV VVN VNW NWP WPG PGD GDM DMR MRF	CAS ASK SKS KSE SER ERG RGT GTY TYE YEQ EQY QYF	KLGGALQAK
2275	CAV AVF	CAS ASS SSL SLT LTL TLS LSD SDT DTQ TQY QYF	KLGGALQAK
5089	CAV AVS VSL SLG LGF GFS FSG SGS GSA SAR ARQ RQL QLT LTF	CAS ASS SSQ SQL QLG LGR GRG RGD GDN DNE NEQ EQF QFF	KLGGALQAK
29859	CAA AAS ASG SGG GGG GGS GSQ SQG QGN GNL NLI LIF	CAS ASS SSA SAR ARS RSS SSY SYE YEQ EQY QYF	GILGFVFTL
29018	CAL ALQ LQR QRG RGT GTY TYK YKY KYI YIF	CAS ASS SSA SAR ARD RDT DTS TSY SYE YEQ EQY QYF	KLGGALQAK
35254	CAL ALS LSD SDS DSG SGG GGS GSY SYI YIP IPT PTF	CAS ASS SSP SPQ PQT QTG TGK GKR KRL RLY LYE YEQ EQY QYF	AVFDRKSDAK
25107	CAA AAS ASE SET ETS TSY SYD YDK DKV KVI VIF	CAS ASS SSP SPR PRD RDR DRE RER ERG RGE GEQ EQY QYF	RAKFKQLL
34632	CAM AMR MRE REH EHP HPF	CAS ASS SSL SLG LGG GGP GPA PAL ALD LDQ DQP QPQ PQH QHF	KLGGALQAK
34593	CAV AVK VKG KGT GTG TGA GAS ASG SGG GGG GGA GAD ADG DGL GLT LTF	CAS ASR SRG RGT GTG TGG GGL GLS LSY SYE YEQ EQY QYF	KLGGALQAK
25920	CAG AGA GAG AGS GSQ SQG QGN GNL NLI LIF	CAS AST STL TLG LGE GER ERN RNP NPR PRG RGY GYT YTF	GILGFVFTL
35562	CAV AVS VSP SPV PVS VSS SSG SGS GSA SAR ARQ RQL QLT LTF	CSV SVE VEW EWV WVG VGG GGP GPT PTE TEA EAF AFF	KLGGALQAK
35613	CAL ALS LSD SDQ DQF QFK FKA KAA AAG AGN GNK NKL KLT LTF	CAS ASS SSD SDS DSQ SQG QGS GSY SYN YNS NSP SPL PLH LHF	KLGGALQAK
26615	CAA AAK AKE KEG EGG GGS GSE SEK EKL KLV LVF	CSA SAG AGG GGN GNT NTE TEA EAF AFF	RAKFKQLL
36206	CAV AVK VKG KGR GRG RGD GDT DTG TGR GRR RRA RAL ALT LTF	CAS ASS SSE SEQ EQG QGS GSS SSE SEA EAF AFF	KLGGALQAK
34758	CVV VVN VNR NRR RRY RYP YPG PGN GNQ NQF QFY FYF	CAS ASS SSL SLG LGA GAQ AQE QET ETQ TQY QYF	KLGGALQAK
25282	CAV AVG VGP GPT PTG TGK GKL KLI LIF	CAS ASS SSE SED EDR DRG RGY GYQ YQE QET ETQ TQY QYF	KLGGALQAK
187	CAV AVK VKG KGG GGG GGA GAD ADG DGL GLT LTF	CAS ASS SSQ SQG QGA GAF AFS FSV SVE VEQ EQY QYF	ELAGIGILTV
23243	CAT ATH THG HGG GGG GGG GGN GNK NKL KLT LTF	CAS ASS SSL SLR LRP RPG PGR GRA RAY AYE YEQ EQY QYF	KLGGALQAK
26479	CAV AVL VLL LLF LFN FNT NTD TDK DKL KLI LIF	CSA SAR ARG RGP GPG PGR GRG RGE GEQ EQY QYF	KLGGALQAK
104	CGT GTD TDS DSN SND NDY DYK YKL KLS LSF	CAR ARQ RQP QPL PLR LRG RGA GAN ANV NVL VLT LTF	KLGGALQAK
35315	CAV AVE VEQ EQD QDS DSN SNY NYQ YQL QLI LIW	CAW AWA WAL ALP LPP PPG PGA GAN ANV NVL VLT LTF	KLGGALQAK
35638	CAV AVR VRD RDI DIL ILK LKA KAA AAG AGN GNK NKL KLT LTF	CAS ASS SSR SRT RTE TEE EET ETQ TQY QYF	KLGGALQAK
34124	CAV AVL VLN LNS NSG SGG GGY GYQ YQK QKV KVT VTF	CAS ASS SSE SEG EGT GTS TSG SGQ GQE QET ETQ TQY QYF	KLGGALQAK
28933	CAG AGT GTY TYG YGG GGS GSQ SQG QGN GNL NLI LIF	CAA AAS ASS SSR SRS RST STD TDT DTQ TQY QYF	GILGFVFTL
35853	CAV AVT VTP TPP PPG PGD GDM DMR MRF	CAS ASS SSI SIG IGQ GQG QGQ GQS QSP SPL PLH LHF	KLGGALQAK
35745	CAV AVW VWY WYM YMR MRF	CAS ASI SIP IPA PAG AGG GGP GPG PGD GDT DTQ TQY QYF	KLGGALQAK
35029	CLV LVV VVF VFG FGA GAG AGS GSY SYQ YQL QLT LTF	CAS ASS SST STQ TQM QME MET ETQ TQY QYF	KLGGALQAK
34316	CAE AES ESG SGY GYS YSS SSA SAS ASK SKI KII IIF	CAS ASS SSQ SQE QEG EGR GRE RET ETE TEA EAF AFF	KLGGALQAK
31619	CAE AED EDY DYG YGG GGS GSQ SQG QGN GNL NLI LIF	CAS ASS SSS SSR SRS RSA SAN ANE NEQ EQF QFF	GILGFVFTL
6946	CAV AVQ VQA QAF AFV FVE VEE EET ETS TSG SGS GSR SRL RLT LTF	CAS ASS SSI SIR IRS RSS SSY SYE YEQ EQY QYF	GILGFVFTL
34983	CAL ALS LSE SET ETM TMD MDS DSN SNY NYQ YQL QLI LIW	CAS ASS SSL SLI LIF IFP FPG PGD GDL DLP LPH PHQ HQE QET ETQ TQY QYF	KLGGALQAK
25016	CAV AVM VMK MKD KDP DPN PNA NAG AGG GGT GTS TSY SYG YGK GKL KLT LTF	CAS ASS SSW SWG WGG GGG GGS GSH SHY HYG YGY GYT YTF	IVTDFSVIK
34709	CAG AGP GPQ PQT QTL TLS LSG SGG GGY GYN YNK NKL KLI LIF	CAS ASS SSY SYL YLG LGD GDN DNN NNQ NQP QPQ PQH QHF	KLGGALQAK
5640	CAF AFM FMV MVN VNA NAG AGG GGT GTS TSY SYG YGK GKL KLT LTF	CAS ASS SSI SIG IGS GSY SYG YGY GYT YTF	GILGFVFTL
35178	CAI AIG IGP GPG PGN GNM NML MLT LTF	CAS ASS SSR SRA RAG AGA GAT ATY TYN YNE NEQ EQF QFF	KLGGALQAK
34565	CAL ALS LSE SEE EEV EVD VDY DYG YGN GNN NNR NRL RLA LAF	CAT ATS TSL SLA LAE AES EST STD TDT DTQ TQY QYF	KLGGALQAK
25270	CAA AAS ASE SET ETS TSY SYD YDK DKV KVI VIF	CAS ASL SLR LRL RLG LGI GID IDQ DQE QET ETQ TQY QYF	RAKFKQLL
35964	CAA AAS ASA SAN ANN NNY NYG YGQ GQN QNF NFV FVF	CAT ATN TNR NRG RGF GFT FTE TEA EAF AFF	AVFDRKSDAK
35668	CAA AAF AFT FTS TSG SGT GTY TYK YKY KYI YIF	CAS ASS SSY SYV YVG VGG GGP GPG PGD GDT DTQ TQY QYF	KLGGALQAK
17040	CAM AMN MNY NYG YGG GGS GSQ SQG QGN GNL NLI LIF	CAS ASS SSQ SQD QDW DWG WGT GTV TVY VYG YGY GYT YTF	KLGGALQAK
35477	CAV AVQ VQA QAR ART RTD TDK DKL KLI LIF	CSG SGA GAT ATG TGL GLS LSY SYN YNE NEQ EQF QFF	KLGGALQAK
34697	CAL ALI LIN INT NTS TSG SGT GTY TYK YKY KYI YIF	CAS ASS SST STA TAD ADR DRW RWY WYG YGY GYT YTF	KLGGALQAK
21476	CVV VVS VSE SEN ENT NTG TGF GFQ FQK QKL KLV LVF	CAS ASS SSL SLR LRD RDG DGS GSE SEA EAF AFF	RAKFKQLL
35667	CAA AAS ASA SAD ADA DAR ARL RLM LMF	CAS ASS SSY SYV YVA VAG AGG GGQ GQE QET ETQ TQY QYF	KLGGALQAK
25029	CIV IVM VMD MDD DDF DFQ FQK QKL KLV LVF	CAS ASS SSS SSH SHG HGA GAG AGA GAY AYN YNE NEQ EQF QFF	RAKFKQLL
25806	CAA AAM AME MET ETS TSY SYD YDK DKV KVI VIF	CAS ASS SSS SSG SGL GLA LAG AGL GLN LNE NEQ EQF QFF	RAKFKQLL
26127	CAM AMR MRE RED EDD DDR DRD RDS DST STL TLG LGR GRL RLY LYF	CSA SAG AGQ GQG QGL GLA LAG AGG GGP GPG PGT GTD TDT DTQ TQY QYF	RAKFKQLL
7674	CAA AAS ASE SET ETS TSY SYD YDK DKV KVI VIF	CAS ASI SIV IVR VRN RND NDR DRD RDP DPT PTG TGE GEL ELF LFF	RAKFKQLL
34931	CAL ALI LIR IRA RAD ADS DSW SWG WGK GKF KFQ FQF	CAI AIS ISE SEG EGE GEG EGV GVS VSY SYN YNS NSP SPL PLH LHF	KLGGALQAK
34081	CAT ATD TDD DDM DMR MRF	CAS ASS SSP SPP PPG PGA GAP APN PNY NYG YGY GYT YTF	KLGGALQAK
34956	CAL ALS LSE SEA EAF AFS FSG SGN GNT NTP TPL PLV LVF	CAS ASR SRG RGP GPV PVE VET ETQ TQY QYF	KLGGALQAK
23828	CAG AGS GST STT TTD TDS DSW SWG WGK GKL KLQ LQF	CAS ASY SYD YDR DRG RGT GTE TEA EAF AFF	KLGGALQAK
22358	CAV AVP VPY PYN YNQ NQG QGG GGK GKL KLI LIF	CAS ASS SSG SGP GPG PGG GGV GVD VDE DEQ EQY QYF	RAKFKQLL
34902	CAA AAS ASV SVW VWY WYA YAR ARL RLM LMF	CAS ASS SSG SGT GTS TSG SGN GNT NTG TGE GEL ELF LFF	KLGGALQAK
32524	CAV AVV VVR VRG RGI GIS ISR SRW RWH WHQ HQN QNA NAG AGG GGT GTS TSY SYG YGK GKL KLT LTF	CAS ASS SSI SIR IRS RSA SAQ AQP QPQ PQH QHF	GILGFVFTL
7356	CAV AVS VSE SEY EYS YST STL TLT LTF	CAS ASG SGL GLN LNP NPQ PQE QER ERS RST STD TDT DTQ TQY QYF	RAKFKQLL
35649	CAL ALS LSE SEL ELD LDT DTD TDK DKL KLI LIF	CAS ASS SSY SYG YGA GAG AGE GER ERY RYE YEQ EQY QYF	KLGGALQAK
27090	CAV AVQ VQP QPG PGA GAN ANN NNL NLF LFF	CSV SVE VEL ELI LIG IGY GYT YTF	KLGGALQAK
36231	CAL ALS LSE SEA EAG AGN GNF NFN FNK NKF KFY FYF	CAS ASS SSS SSE SEA EAG AGA GAR ARE RET ETQ TQY QYF	KLGGALQAK
35403	CAV AVT VTR TRS RSN SND NDY DYK YKL KLS LSF	CSA SAG AGG GGG GGA GAT ATY TYN YNE NEQ EQF QFF	KLGGALQAK
34304	CAE AER ERS RSL SLN LNN NNT NTD TDK DKL KLI LIF	CAS ASS SSP SPR PRP RPS PSG SGG GGH GHS HST STD TDT DTQ TQY QYF	KLGGALQAK
19422	CAG AGN GNY NYG YGG GGS GSQ SQG QGN GNL NLI LIF	CAS ASS SSL SLR LRD RDG DGS GSE SEA EAF AFF	RAKFKQLL
32195	CAG AGG GGG GGS GSQ SQG QGN GNL NLI LIF	CAS ASS SSF SFR FRS RSS SSE SET ETQ TQY QYF	GILGFVFTL
34447	CVV VVR VRE RER ERG RGG GGG GGN GNK NKL KLT LTF	CAS ASS SSS SSR SRI RIR IRE REH EHE HEQ EQY QYF	KLGGALQAK
27291	CAD ADS DSG SGG GGG GGA GAD ADG DGL GLT LTF	CSV SVG VGS GSG SGD GDH DHG HGE GEQ EQF QFF	RAKFKQLL
30515	CAG AGG GGG GGS GSS SSN SNT NTG TGK GKL KLI LIF	CAS ASS SSI SIR IRS RSS SSY SYE YEQ EQF QFF	GILGFVFTL
2292	CAV AVE VEG EGP GPT PTD TDS DSW SWG WGK GKF KFQ FQF	CAS ASS SSL SLG LGD GDP DPT PTN TNY NYG YGY GYT YTF	KLGGALQAK
11196	CAV AVR VRF RFN FNA NAG AGN GNM NML MLT LTF	CAS ASS SSF SFS FSG SGN GNT NTG TGE GEL ELF LFF	RAKFKQLL
34453	CAV AVT VTS TSR SRS RSG SGG GGY GYQ YQK QKV KVT VTF	CAS ASI SIA IAG AGP GPG PGT GTG TGG GGE GEK EKL KLF LFF	KLGGALQAK
35854	CAM AMR MRG RGT GTK TKT KTS TSY SYD YDK DKV KVI VIF	CAS ASS SSI SIG IGR GRS RST STE TEA EAF AFF	KLGGALQAK
34023	CAV AVR VRE REV EVD VDR DRT RTG TGK GKL KLI LIF	CAT ATS TSR SRA RAS AST STD TDT DTQ TQY QYF	KLGGALQAK
5599	CAA AAN ANY NYG YGG GGS GSQ SQG QGN GNL NLI LIF	CAS ASS SSG SGR GRS RST STG TGE GEL ELF LFF	GILGFVFTL
33502	CAG AGA GAG AGG GGG GGS GSQ SQG QGN GNL NLI LIF	CAS ASS SSM SMR MRS RST STD TDT DTQ TQY QYF	GILGFVFTL
24291	CAG AGL GLT LTD TDG DGQ GQN QNF NFV FVF	CAS ASS SSP SPD PDS DSN SNG NGY GYT YTF	KLGGALQAK
34829	CAV AVN VNT NTG TGF GFQ FQK QKL KLV LVF	CAS ASS SSL SLG LGQ GQG QGT GTS TSG SGG GGG GGI GIN INT NTG TGE GEL ELF LFF	KLGGALQAK
34511	CAM AMR MRP RPP PPF PFR FRG RGG GGY GYN YNK NKL KLI LIF	CVS VSS SSS SSR SRD RDS DSQ SQN QNQ NQP QPQ PQH QHF	KLGGALQAK
30032	CAY AYS YSS SSN SNA NAG AGG GGT GTS TSY SYG YGK GKL KLT LTF	CAS ASS SSI SIG IGL GLY LYG YGY GYT YTF	GILGFVFTL
34939	CAD ADS DSG SGF GFQ FQK QKL KLV LVF	CAS ASS SSF SFG FGT GTG TGN GNY NYG YGY GYT YTF	KLGGALQAK
34996	CAV AVR VRD RDM DMY MYN YNA NAR ARL RLM LMF	CAS ASS SSP SPP PPG PGQ GQL QLS LSY SYE YEQ EQY QYF	KLGGALQAK
35258	CAV AVG VGH GHE HED EDG DGG GGS GSN SNY NYK YKL KLT LTF	CAS ASS SSP SPV PVF VFR FRT RTE TEQ EQY QYF	KLGGALQAK
34957	CAG AGN GNS NSG SGT GTY TYK YKY KYI YIF	CAS ASR SRG RGP GPV PVE VET ETQ TQY QYF	KLGGALQAK
5142	CAT ATE TEG EGA GAS ASG SGG GGS GSY SYI YIP IPT PTF	CAW AWV WVL VLG LGP GPA PAG AGD GDT DTQ TQY QYF	KLGGALQAK
7667	CAF AFL FLL LLT LTD TDS DSN SNY NYQ YQL QLI LIW	CAS ASS SSF SFS FSG SGN GNT NTG TGE GEL ELF LFF	RAKFKQLL
26512	CAV AVR VRS RSP SPH PHS HSW SWG WGK GKL KLQ LQF	CSA SAS ASG SGL GLA LAG AGV GVL VLT LTD TDT DTQ TQY QYF	AVFDRKSDAK
16981	CAV AVV VVD VDS DSG SGY GYA YAL ALN LNF	CAS ASS SSP SPL PLI LIG IGA GAN ANV NVL VLT LTF	KLGGALQAK
200	CAV AVW VWS WSY SYG YGG GGS GSQ SQG QGN GNL NLI LIF	CAS ASS SSH SHG HGQ GQG QGR GRG RGN GNT NTE TEA EAF AFF	KLGGALQAK
6609	CAG AGQ GQY QYR YRD RDD DDK DKI KII IIF	CAS ASS SSI SIG IGL GLG LGE GEQ EQY QYF	GILGFVFTL
140	CGP GPG PGG GGY GYN YNK NKL KLI LIF	CAS ASS SSL SLA LAG AGT GTS TSG SGR GRD RDE DEQ EQF QFF	KLGGALQAK
4926	CAY AYR YRS RSV SVG VGT GTP TPL PLV LVF	CAS ASS SSL SLG LGA GAG AGK GKV KVT VTD TDT DTQ TQY QYF	KLGGALQAK
30395	CAV AVR VRD RDK DKP KPP PPG PGP GPG PGG GGG GGS GSY SYI YIP IPT PTF	CAS ASS SSI SIH IHG HGA GAG AGT GTE TEA EAF AFF	GILGFVFTL
5062	CAG AGA GAS ASN SNT NTG TGK GKL KLI LIF	CAS ASS SSL SLG LGD GDN DNT NTE TEA EAF AFF	GILGFVFTL
5107	CAF AFM FML MLG LGA GAG AGG GGT GTS TSY SYG YGK GKL KLT LTF	CAS ASS SSF SFL FLT LTG TGN GNT NTE TEA EAF AFF	GILGFVFTL
31938	CAT ATD TDA DAG AGG GGG GGS GSQ SQG QGN GNL NLI LIF	CAS ASM SME MEL ELA LAG AGL GLN LNE NEQ EQF QFF	GILGFVFTL
35641	CAE AEN ENM NMR MRA RAG AGN GNM NML MLT LTF	CAS ASS SSS SSF SFM FMG MGN GNQ NQP QPQ PQH QHF	KLGGALQAK
36269	CAA AAH AHP HPP PPM PMY MYS YSG SGG GGG GGA GAD ADG DGL GLT LTF	CSA SAD ADS DSG SGE GEL ELS LSY SYE YEQ EQY QYF	KLGGALQAK
6164	CAA AAD ADN DNY NYG YGG GGS GSQ SQG QGN GNL NLI LIF	CAS ASS SSI SIY IYG YGG GGA GAG AGD GDG DGY GYT YTF	GILGFVFTL
34608	CVV VVS VSD SDT DTS TSG SGT GTY TYK YKY KYI YIF	CAS ASS SSF SFL FLG LGG GGR GRN RNP NPN PNE NEQ EQF QFF	KLGGALQAK
13976	CAA AAA AAE AET ETS TSY SYD YDK DKV KVI VIF	CAS ASS SSN SNS NSG SGA GAN ANV NVL VLT LTF	RAKFKQLL
36106	CAY AYR YRR RRD RDD DDK DKI KII IIF	CAS ASS SSQ SQG QGL GLA LAA AAS ASY SYE YEQ EQY QYF	KLGGALQAK
35687	CAM AMS MSA SAG AGN GNN NNN NND NDM DMR MRF	CAS ASS SSD SDR DRD RDR DRV RVE VEQ EQY QYF	KLGGALQAK
33898	CIV IVN VND NDA DAG AGT GTS TSY SYG YGK GKL KLT LTF	CAS ASS SSQ SQE QEL ELS LSR SRR RRN RNT NTE TEA EAF AFF	KLGGALQAK
5799	CAG AGA GAD ADG DGG GGG GGS GSQ SQG QGN GNL NLI LIF	CAS ASS SSI SIR IRS RSG SGY GYE YEQ EQY QYF	GILGFVFTL
57	CAS ASI SIA IAG AGT GTY TYK YKY KYI YIF	CAS ASS SSF SFS FSG SGN GNT NTG TGE GEL ELF LFF	RAKFKQLL
35303	CAE AER ERS RSG SGG GGS GSY SYI YIP IPT PTF	CAS ASS SSR SRT RTG TGG GGT GTD TDT DTQ TQY QYF	KLGGALQAK
34334	CAL ALF LFR FRN RNS NSG SGN GNT NTP TPL PLV LVF	CAS ASS SSQ SQG QGT GTY TYE YEQ EQY QYF	KLGGALQAK
183	CAW AWK WKS KSN SNQ NQF QFY FYF	CAS ASS SSQ SQE QEL ELL LLS LSS SSG SGE GEL ELF LFF	ELAGIGILTV
28301	CAA AAS AST STN TNA NAR ARL RLM LMF	CSV SVQ VQG QGG GGA GAY AYN YNE NEQ EQF QFF	KLGGALQAK
5132	CAL ALK LKL KLI LIK IKA KAA AAG AGN GNK NKL KLT LTF	CAW AWT WTG TGT GTG TGK GKI KIG IGW GWD WDS DSP SPL PLH LHF	KLGGALQAK
14674	CAV AVN VNI NIR IRQ RQA QAG AGT GTA TAL ALI LIF	CAS ASS SSG SGG GGD GDR DRG RGT GTE TEA EAF AFF	KLGGALQAK
35428	CAV AVR VRD RDG DGG GGM GMG MGS GSN SNT NTG TGK GKL KLI LIF	CSA SAR ARD RDL DLE LEV EVL VLS LSY SYE YEQ EQY QYF	KLGGALQAK
35162	CIL ILG LGE GEK EKT KTS TSY SYD YDK DKV KVI VIF	CAS ASS SSL SLG LGY GYG YGM GMN MNT NTE TEA EAF AFF	KLGGALQAK
35454	CAV AVN VNS NSW SWN WNN NNN NNA NAR ARL RLM LMF	CSA SAS ASP SPR PRG RGY GYT YTE TEA EAF AFF	KLGGALQAK
34173	CAV AVR VRG RGR GRV RVS VST STD TDK DKL KLI LIF	CAS ASS SSQ SQD QDQ DQG QGI GIT ITE TEA EAF AFF	KLGGALQAK
5273	CAM AMR MRE REG EGW GWN WNT NTG TGF GFQ FQK QKL KLV LVF	CSV SVE VET ETG TGG GGQ GQG QGA GAW AWD WDT DTQ TQY QYF	KLGGALQAK
15827	CAL ALG LGD GDS DSG SGA GAG AGS GSY SYQ YQL QLT LTF	CAS ASS SST STS TST STG TGT GTG TGY GYG YGY GYT YTF	RAKFKQLL
14675	CAD ADS DSG SGG GGG GGA GAD ADG DGL GLT LTF	CAS ASS SSG SGR GRT RTG TGS GSS SSY SYE YEQ EQY QYF	GILGFVFTL
34300	CAV AVN VNP NPE PEG EGS GST STL TLT LTF	CAS ASS SSP SPG PGE GEF EFE FEK EKL KLF LFF	KLGGALQAK
5527	CAV AVN VNA NAG AGN GND NDM DMR MRF	CAS ASS SSY SYG YGQ GQG QGW GWG WGY GYT YTF	ELAGIGILTV
24351	CDT DTL TLD LDN DNN NND NDM DMR MRF	CAI AIS ISE SES ESL SLT LTP TPP PPG PGL GLP LPL PLF LFN FNY NYG YGY GYT YTF	KLGGALQAK
32247	CAA AAK AKE KEG EGY GYS YST STL TLT LTF	CAS ASS SSG SGG GGG GGV GVY VYG YGY GYT YTF	KLGGALQAK
34808	CAY AYM YMW MWG WGG GGT GTS TSY SYG YGK GKL KLT LTF	CAS ASR SRW RWD WDS DSY SYN YNQ NQP QPQ PQH QHF	KLGGALQAK
35103	CGS GSG SGD GDY DYK YKL KLS LSF	CAS ASM SMA MAV AVG VGA GAN ANV NVL VLT LTF	ELAGIGILTV
15326	CAV AVV VVE VEF EFG FGG GGS GSN SNY NYK YKL KLT LTF	CAS ASS SSQ SQG QGL GLG LGE GEN ENT NTE TEA EAF AFF	RAKFKQLL
34864	CAG AGV GVW VWA WAD ADS DSW SWG WGK GKL KLQ LQF	CAS ASS SSQ SQL QLN LNT NTY TYG YGY GYT YTF	KLGGALQAK
22315	CVV VVT VTD TDF DFN FNA NAG AGN GNN NNR NRK RKL KLI LIW	CAS ASS SSP SPG PGG GGG GGY GYT YTF	KLGGALQAK
35002	CAD ADY DYT YTG TGN GNQ NQF QFY FYF	CAS ASS SSS SSP SPV PVT VTG TGQ GQT QTE TEA EAF AFF	KLGGALQAK
30493	CAA AAK AKS KSN SNT NTG TGK GKL KLI LIF	CAS ASS SSI SIR IRS RSS SSE SET ETQ TQY QYF	GILGFVFTL
25767	CAR ARE REH EHM HMD MDS DSN SNY NYQ YQL QLI LIW	CAS ASS SSQ SQL QLG LGR GRG RGD GDN DNE NEQ EQF QFF	GILGFVFTL
28307	CGA GAD ADG DGG GGG GGT GTY TYK YKY KYI YIF	CSY SYS YSA SAG AGE GED EDQ DQP QPQ PQH QHF	RAKFKQLL
34051	CLV LVG VGD GDM DME MEG EGG GGS GST STL TLG LGR GRL RLY LYF	CAS ASR SRY RYG YGT GTP TPG PGT GTE TEA EAF AFF	KLGGALQAK
32253	CIV IVR VRV RVS VSG SGA GAG AGG GGT GTS TSY SYG YGK GKL KLT LTF	CAS ASS SSG SGR GRS RSG SGE GET ETQ TQY QYF	GILGFVFTL
53	CAV AVG VGG GGL GLV LVF VFG FGN GNE NEK EKL KLT LTF	CAS ASS SSF SFS FSG SGN GNT NTG TGE GEL ELF LFF	RAKFKQLL
34696	CAV AVN VNG NGF GFG FGN GNV NVL VLH LHC	CAS ASS SSS SSQ SQG QGN GNT NTG TGE GEL ELF LFF	KLGGALQAK
7882	CAG AGA GAG AGN GNY NYQ YQL QLI LIW	CAS ASS SSF SFL FLD LDR DRG RGP GPN PNT NTE TEA EAF AFF	RAKFKQLL
99	CAL ALD LDE DEA EAG AGT GTA TAS ASK SKL KLT LTF	CAS ASS SSP SPP PPA PAG AGS GSG SGQ GQE QET ETQ TQY QYF	KLGGALQAK
32537	CAL ALK LKI KIP IPL PLV LVF	CAS ASS SSI SIR IRS RSA SAY AYE YEQ EQY QYF	GILGFVFTL
10119	CAV AVD VDP DPM PMD MDT DTG TGR GRR RRA RAL ALT LTF	CAS ASS SSF SFS FSG SGN GNT NTG TGE GEL ELF LFF	RAKFKQLL
23241	CAG AGG GGG GGS GSQ SQG QGN GNL NLI LIF	CAS ASS SSL SLP LPG PGT GTG TGG GGS GSP SPL PLH LHF	GILGFVFTL
35741	CGT GTF TFP FPP PPY PYS YSS SSA SAS ASK SKI KII IIF	CAS ASS SSY SYF YFG FGG GGT GTE TEA EAF AFF	KLGGALQAK
24	CIL ILR LRE RET ETS TSY SYD YDK DKV KVI VIF	CAS ASA SAL ALL LLS LSS SSY SYN YNS NSP SPL PLH LHF	GILGFVFTL
2368	CAE AEM EME MEG EGG GGS GSY SYI YIP IPT PTF	CAS ASS SSL SLR LRG RGD GDR DRG RGD GDT DTQ TQY QYF	KLGGALQAK
34798	CAV AVN VNV NVP VPS PSD SDG DGQ GQK QKL KLL LLF	CAS ASA SAP APH PHG HGG GGP GPI PIN INT NTG TGE GEL ELF LFF	KLGGALQAK
36156	CGT GTE TEI EIG IGG GGG GGT GTS TSY SYG YGK GKL KLT LTF	CAS ASG SGT GTE TET ETQ TQY QYF	KLGGALQAK
5051	CAV AVR VRD RDI DIG IGN GNQ NQG QGG GGK GKL KLI LIF	CAS ASS SSH SHS HSS SSG SGG GGV GVA VAD ADT DTQ TQY QYF	KLGGALQAK
18246	CAA AAL ALM LMN MNR NRD RDD DDK DKI KII IIF	CAS ASS SSL SLR LRD RDG DGS GSE SEA EAF AFF	RAKFKQLL
25274	CAV AVR VRG RGQ GQA QAG AGT GTA TAL ALI LIF	CAS ASS SSA SAG AGQ GQA QAG AGF GFS FSP SPL PLH LHF	KLGGALQAK
2560	CVV VVN VNM NMD MDN DNA NAR ARL RLM LMF	CAS ASS SSL SLG LGD GDF DFL FLR LRT RTD TDT DTQ TQY QYF	RAKFKQLL
34954	CAV AVL VLG LGV GVY VYN YNT NTN TNA NAG AGK GKS KST STF	CAS ASR SRF RFY FYR YRG RGN GNY NYG YGY GYT YTF	KLGGALQAK
6236	CAG AGA GAH AHG HGS GSS SSN SNT NTG TGK GKL KLI LIF	CAS ASS SSM SMD MDR DRG RGS GSA SAD ADT DTQ TQY QYF	GILGFVFTL
34782	CIL ILR LRD RDF DFL FLQ LQG QGA GAQ AQK QKL KLV LVF	CAS ASS SSP SPE PEA EAG AGA GAL ALF LFN FNE NEQ EQF QFF	KLGGALQAK
238	CAA AAQ AQG QGA GAQ AQK QKL KLV LVF	CAS ASS SSQ SQG QGL GLV LVS VSG SGS GSP SPL PLH LHF	ELAGIGILTV
35993	CAE AEN ENL NLV LVL VLN LNT NTD TDK DKL KLI LIF	CAS ASS SSS SST STG TGL GLN LNT NTE TEA EAF AFF	KLGGALQAK
30385	CAF AFM FMI MIG IGA GAG AGG GGT GTS TSY SYG YGK GKL KLT LTF	CAS ASS SSI SIG IGV GVW VWG WGY GYT YTF	GILGFVFTL
7265	CAE AEL ELK LKE KEK EKL KLI LIF	CAS ASS SSQ SQS QSP SPG PGG GGT GTQ TQY QYF	GLCTLVAML
36182	CAF AFL FLT LTS TSG SGG GGS GSY SYI YIP IPT PTF	CAS ASS SSR SRS RSR SRG RGL GLE LEH EHY HYE YEQ EQY QYF	AVFDRKSDAK
34721	CAV AVQ VQD QDE DER ERG RGS GST STL TLG LGR GRL RLY LYF	CAS ASS SSF SFT FTA TAG AGS GST STG TGE GEL ELF LFF	KLGGALQAK
5473	CAE AEN ENG NGG GGG GGG GGA GAD ADG DGL GLT LTF	CAS ASS SST STT TTA TAG AGD GDT DTE TEA EAF AFF	KLGGALQAK
36118	CAM AMR MRE REA EAN ANT NTG TGN GNQ NQF QFY FYF	CAS ASS SSV SVA VAG AGG GGE GEA EAE AEA EAF AFF	KLGGALQAK
35017	CAV AVN VNN NNF NFN FNK NKF KFY FYF	CAS ASS SSL SLD LDM DMS MSG SGS GSY SYE YEQ EQY QYV	KLGGALQAK
35830	CAE AEK EKT KTS TSY SYD YDK DKV KVI VIF	CAS ASS SSI SIA IAG AGY GYT YTE TEA EAF AFF	KLGGALQAK
35452	CAP APG PGP GPD PDS DSS SSY SYK YKL KLI LIF	CSA SAR ARV RVP VPA PAG AGA GAS AST STD TDT DTQ TQY QYF	KLGGALQAK
32502	CAG AGG GGG GGS GSQ SQG QGN GNL NLI LIF	CAS ASS SSI SIR IRA RAA AAY AYE YEQ EQY QYF	GILGFVFTL
34680	CAV AVN VNM NMD MDT DTG TGN GNQ NQF QFY FYF	CAS ASS SSP SPH PHS HSY SYE YEQ EQY QYF	ELAGIGILTV
35556	CAF AFG FGF GFN FNN NNA NAR ARL RLM LMF	CSV SVE VEG EGS GSG SGG GGF GFQ FQE QET ETQ TQY QYF	KLGGALQAK
32769	CAD ADS DSG SGG GGG GGA GAD ADG DGL GLT LTF	CAS ASS SSI SIR IRS RSS SSY SYE YEQ EQY QYF	GILGFVFTL
36023	CAM AMR MRR RRP RPI PIS ISS SSG SGS GSA SAR ARQ RQL QLT LTF	CAS ASS SSS SSR SRD RDN DNQ NQE QET ETQ TQY QYF	KLGGALQAK
34635	CAG AGN GNT NTP TPL PLV LVF	CAS ASS SSL SLG LGL GLG LGQ GQP QPQ PQH QHF	ELAGIGILTV
35628	CAE AET ETD TDN DNA NAG AGN GNM NML MLT LTF	CAS ASS SSF SFT FTV TVL VLG LGD GDE DEQ EQY QYF	KLGGALQAK
25299	CAA AAA AAE AET ETS TSY SYD YDK DKV KVI VIF	CAS ASS SSF SFV FVD VDR DRA RAE AET ETQ TQY QYF	RAKFKQLL
35152	CAA AAS ASY SYN YNT NTD TDK DKL KLI LIF	CAS ASS SSL SLA LAT ATG TGY GYE YEQ EQY QYV	KLGGALQAK
6240	CAV AVG VGA GAG AGG GGG GGS GSQ SQG QGN GNL NLI LIF	CAS ASS SSM SMR MRA RAS ASV SVE VEQ EQF QFF	GILGFVFTL
64	CAF AFL FLG LGG GGA GAN ANN NNL NLF LFF	CAS ASS SSL SLA LAA AAS ASY SYE YEQ EQY QYF	KLGGALQAK
35022	CAV AVS VSD SDL DLY LYG YGG GGS GSQ SQG QGN GNL NLI LIF	CAS ASS SSP SPP PPG PGT GTS TSG SGS GSS SSS SSY SYN YNE NEQ EQF QFF	KLGGALQAK
33903	CAE AEN ENE NED EDT DTD TDK DKL KLI LIF	CAS ASS SSP SPG PGQ GQG QGI GIA IAG AGE GEL ELF LFF	KLGGALQAK
28845	CAV AVA VAK AKD KDL DLQ LQN QNS NSG SGG GGG GGA GAD ADG DGL GLT LTF	CAS ASG SGM GMT MTG TGL GLT LTS TSE SEQ EQY QYF	GILGFVFTL
262	CAV AVT VTP TPY PYT YTG TGG GGF GFK FKT KTI TIF	CAS ASS SSQ SQV QVS VSS SSR SRQ RQP QPH PHT HTE TEA EAF AFF	RAKFKQLL
33509	CAI AIG IGG GGD GDG DGG GGS GSQ SQG QGN GNL NLI LIF	CAS ASS SSP SPR PRS RSG SGN GNT NTI TIY IYF	GILGFVFTL
34974	CAQ AQT QTG TGA GAN ANN NNL NLF LFF	CAS ASS SSL SLF LFQ FQG QGS GSG SGT GTE TEA EAF AFF	KLGGALQAK
34264	CAI AIG IGP GPG PGN GNM NML MLT LTF	CAS ASS SSQ SQD QDR DRP RPG PGG GGR GRP RPY PYN YNE NEQ EQF QFF	KLGGALQAK
7069	CAV AVR VRG RGG GGV GVH VHG HGN GNN NNR NRL RLA LAF	CAS ASS SSI SIS ISP SPN PNQ NQP QPQ PQH QHF	KLGGALQAK
56	CAV AVS VSP SPW PWG WGG GGY GYN YNK NKL KLI LIF	CAS ASS SSF SFS FSG SGN GNT NTG TGE GEL ELF LFF	RAKFKQLL
35644	CAM AMR MRE REW EWG WGS GSG SGS GSR SRL RLT LTF	CAS ASS SSS SSQ SQG QGS GSN SNY NYG YGY GYT YTF	KLGGALQAK
679	CAP API PIG IGG GGG GGN GNK NKL KLT LTF	CAS ASS SSL SLP LPT PTA TAN ANY NYG YGY GYT YTF	KLGGALQAK
19	CAV AVG VGA GAN ANY NYQ YQL QLI LIW	CAT ATS TSD SDW DWL WLA LAG AGD GDA DAD ADT DTQ TQY QYF	KLGGALQAK
4952	CLV LVA VAP APG PGG GGY GYN YNK NKL KLI LIF	CAS ASS SSS SSQ SQG QGA GAL ALK LKR KRE REI EIP IPY PYE YEQ EQY QYF	IVTDFSVIK
28373	CAL ALS LSE SER ERV RVS VSG SGG GGY GYN YNK NKL KLI LIF	CAS ASS SSL SLK LKG KGQ GQG QGS GSD SDT DTQ TQY QYF	IVTDFSVIK
34386	CAV AVN VNT NTN TNA NAG AGK GKS KST STF	CAS ASS SSQ SQG QGQ GQN QNQ NQE QET ETQ TQY QYF	KLGGALQAK
33366	CAG AGA GAG AGG GGG GGS GSQ SQG QGN GNL NLI LIF	CAS ASS SSI SIR IRS RST STD TDT DTQ TQY QYF	GILGFVFTL
4945	CAM AMR MRV RVG VGN GNN NNN NND NDM DMR MRF	CAS ASS SSL SLV LVA VAT ATG TGL GLS LSY SYE YEQ EQY QYF	KLGGALQAK
14644	CIL ILY LYN YNT NTD TDK DKL KLI LIF	CAS ASS SSD SDR DRD RDY DYL YLI LIH IHE HEQ EQF QFF	KLGGALQAK
6092	CAG AGP GPY PYN YNQ NQG QGG GGK GKL KLI LIF	CAS ASS SSI SIR IRS RST STE TET ETQ TQY QYF	GILGFVFTL
34318	CAV AVK VKR KRG RGD GDD DDK DKI KII IIF	CAS ASS SSQ SQG QGL GLA LAG AGI GIA IAT ATQ TQE QET ETQ TQY QYF	KLGGALQAK
34877	CAL ALS LSE SEE EES ESG SGE GEV EVI VIF	CAS ASS SSD SDF DFG FGI GIS ISG SGT GTY TYN YNE NEQ EQF QFF	KLGGALQAK
24428	CAT ATD TDA DAS ASG SGG GGS GSN SNY NYK YKL KLT LTF	CAS ASS SSL SLG LGT GTS TSG SGG GGT GTG TGE GEL ELF LFF	RAKFKQLL
6089	CAV AVD VDE DEG EGG GGG GGS GSQ SQG QGN GNL NLI LIF	CAS ASS SSI SIR IRS RST STD TDT DTQ TQY QYF	GILGFVFTL
33844	CAP APS PSA SAG AGG GGG GGS GSQ SQG QGN GNL NLI LIF	CAS ASS SSV SVR VRS RSS SSY SYE YEQ EQY QYF	GILGFVFTL
38421	CAV AVR VRD RDG DGD GDR DRD RDD DDK DKI KII IIF	CAS ASS SSY SYL YLG LGQ GQG QGD GDA DAY AYG YGY GYT YTF	KLGGALQAK
26022	CAV AVR VRV RVG VGT GTT TTD TDS DSL SLL	CAS ASS SSP SPL PLS LST STD TDT DTQ TQY QYF	GILGFVFTL
35573	CAV AVT VTG TGG GGN GND NDY DYK YKL KLS LSF	CSV SVQ VQG QGA GAN ANT NTG TGE GEL ELF LFF	KLGGALQAK
26569	CAA AAK AKE KEG EGY GYS YST STL TLT LTF	CSA SAG AGG GGN GNT NTE TEA EAF AFF	RAKFKQLL
34831	CVV VVN VNG NGY GYS YSS SSA SAS ASK SKI KII IIF	CAS ASS SSL SLQ LQG QGD GDE DEQ EQY QYV	KLGGALQAK
5073	CAV AVN VNG NGG GGY GYN YNK NKL KLI LIF	CAS ASS SSL SLV LVG VGR GRG RGG GGN GNQ NQP QPQ PQH QHF	KLGGALQAK
5115	CAA AAT ATN TNT NTN TNA NAG AGK GKS KST STF	CAS ASS SSP SPT PTT TTG TGE GED EDN DNE NEQ EQF QFF	RAKFKQLL
33858	CAG AGG GGG GGS GSG SGG GGS GSQ SQG QGN GNL NLI LIF	CAS ASS SSW SWR WRS RSD SDT DTE TEA EAF AFF	GILGFVFTL
35125	CAV AVN VNI NIN INQ NQA QAG AGT GTA TAL ALI LIF	CAS ASS SSL SLV LVR VRQ RQG QGA GAS AST STI TIG IGT GTQ TQY QYF	KLGGALQAK
25102	CVV VVR VRF RFT FTG TGG GGG GGN GNK NKL KLT LTF	CAS ASS SSL SLG LGG GGA GAG AGE GET ETQ TQY QYF	GLCTLVAML
25382	CAA AAT ATN TNN NNA NAG AGN GNM NML MLT LTF	CAS ASS SSG SGS GSS SSR SRT RTP TPN PNT NTE TEA EAF AFF	GLCTLVAML
34429	CAF AFD FDS DSG SGA GAG AGS GSY SYQ YQL QLT LTF	CAS ASI SIS ISA SAD ADT DTQ TQY QYF	KLGGALQAK
