5128	CAV AVV VVS VSG SGA GAG AGS GSY SYQ YQL QLT LTF	CAW AWS WSI SIT ITD TDT DTG TGE GEL ELF LFF	KLGGALQAK
26554	CAA AAS ASE SEG EGA GAP APD PDK DKL KLI LIF	CSA SAP APS PSG SGE GEG EGR GRD RDT DTQ TQY QYF	RAKFKQLL
35012	CAA AAP APV PVG VGT GTY TYK YKY KYI YIF	CAS ASR SRT RTP TPL PLD LDT DTQ TQY QYF	KLGGALQAK
26220	CAL ALS LSE SEP EPN PNS NSG SGG GGG GGA GAD ADG DGL GLT LTF	CSA SAR ARD RDD DDS DSG SGQ GQG QGF GFG FGF GFL FLE LET ETQ TQY QYF	GLCTLVAML
17956	CAE AEW EWG WGS GSG SGN GNT NTG TGK GKL KLI LIF	CAS ASS SSV SVA VAG AGG GGT GTE TEQ EQY QYF	KLGGALQAK
34054	CAA AAH AHS HSG SGT GTY TYK YKY KYI YIF	CAS ASS SSF SFG FGS GSQ SQE QET ETQ TQY QYF	KLGGALQAK
32526	CAV AVK VKE KEN ENE NEK EKL KLT LTF	CAS ASS SSI SIR IRS RSA SAY AYE YEQ EQY QYF	GILGFVFTL
24569	CGT GTV TVL VLE LEG EGG GGS GSQ SQG QGN GNL NLI LIF	CAS ASS SSL SLG LGT GTS TSG SGG GGT GTG TGE GEL ELF LFF	GILGFVFTL
2247	CAV AVT VTD TDS DSN SNF NFG FGN GNE NEK EKL KLT LTF	CAS ASS SSL SLA LAQ AQG QGL GLA LAK AKN KNI NIQ IQY QYF	KLGGALQAK
6690	CAL ALT LTD TDY DYS YSG SGA GAG AGS GSY SYQ YQL QLT LTF	CAS ASS SSI SIR IRS RSG SGT GTE TEA EAF AFF	GILGFVFTL
25805	CAG AGH GHT HTG TGN GNQ NQF QFY FYF	CAS ASS SSS SSG SGL GLA LAG AGG GGN GNE NEQ EQF QFF	GILGFVFTL
26049	CAL ALS LSE SEA EAQ AQL QLG LGS GSG SGY GYA YAL ALN LNF	CAW AWS WSV SVG VGQ GQG QGT GTD TDG DGE GEL ELF LFF	KLGGALQAK
6667	CAA AAK AKG KGT GTS TSY SYD YDK DKV KVI VIF	CAS ASS SSI SIH IHS HSN SNQ NQP QPQ PQH QHF	GILGFVFTL
33484	CAA AAT ATG TGG GGG GGS GSQ SQG QGN GNL NLI LIF	CAS ASS SSM SMR MRS RSA SAD ADT DTQ TQY QYF	GILGFVFTL
20245	CAK AKG KGL GLT LTG TGG GGG GGD GDK DKL KLT LTF	CAS ASS SSL SLR LRD RDG DGS GSE SEA EAF AFF	RAKFKQLL
34279	CAV AVR VRA RAG AGN GNQ NQF QFY FYF	CAS ASS SSQ SQG QGV GVA VAG AGG GGQ GQG QGV GVN VNE NEQ EQF QFF	AVFDRKSDAK
35457	CVA VAY AYS YSS SSA SAS ASK SKI KII IIF	CSA SAS ASW SWP WPG PGA GAN ANT NTG TGE GEL ELF LFF	KLGGALQAK
31376	CAA AAS ASG SGG GGG GGS GSQ SQG QGN GNL NLI LIF	CAS ASS SSK SKR KRS RSQ SQE QEP EPQ PQH QHF	GILGFVFTL
13822	CAA AAS ASE SET ETS TSY SYD YDK DKV KVI VIF	CAS ASS SSF SFT FTG TGQ GQA QAN ANT NTE TEA EAF AFF	RAKFKQLL
5173	CAV AVS VSE SEN ENR NRD RDD DDK DKI KII IIF	CSA SAR ARD RDS DST STG TGN GNG NGY GYT YTF	GLCTLVAML
35210	CAG AGA GAP APL PLT LTG TGT GTA TAS ASK SKL KLT LTF	CAS ASS SSA SAS ASS SSG SGG GGA GAY AYY YYT YTQ TQY QYF	KLGGALQAK
18262	CAE AEM EME MEG EGG GGS GSY SYI YIP IPT PTF	CAS ASS SSL SLR LRD RDG DGS GSE SEA EAF AFF	RAKFKQLL
6355	CIV IVF VFY FYN YNQ NQG QGG GGK GKL KLI LIF	CAS ASS SST STR TRS RSS SSY SYE YEQ EQY QYF	GILGFVFTL
6304	CAF AFM FMV MVN VNA NAG AGG GGT GTS TSY SYG YGK GKL KLT LTF	CAS ASS SSQ SQG QGS GSY SYG YGY GYT YTF	GILGFVFTL
32342	CVV VVS VSA SAG AGL GLG LGK GKT KTS TSY SYD YDK DKV KVI VIF	CAS ASS SSI SIF IFY FYS YSS SST STD TDT DTQ TQY QYF	GILGFVFTL
27286	CVV VVT VTE TET ETS TSY SYD YDK DKV KVI VIF	CSV SVG VGS GSG SGD GDH DHG HGE GEQ EQF QFF	RAKFKQLL
34133	CAV AVP VPN PNF NFG FGN GNE NEK EKL KLT LTF	CAS ASS SSF SFT FTG TGS GSD SDT DTG TGE GEL ELF LFF	KLGGALQAK
5076	CAE AEI EIV IVG VGQ GQL QLT LTF	CAS ASS SSP SPG PGG GGL GLE LEN ENE NEQ EQY QYF	KLGGALQAK
5492	CAV AVL VLR LRM RMD MDS DSS SSY SYK YKL KLI LIF	CAS AST STP TPR PRR RRL RLG LGL GLF LFP FPS PSS SSG SGN GNT NTI TIY IYF	KLGGALQAK
2340	CVV VVN VNS NSG SGY GYA YAL ALN LNF	CAS ASS SSF SFT FTG TGA GAG AGN GNE NEQ EQF QFF	KLGGALQAK
14648	CVV VVN VNG NGG GGD GDS DSS SSY SYK YKL KLI LIF	CAS ASS SSE SEG EGQ GQV QVS VSP SPG PGE GEL ELF LFF	GLCTLVAML
6559	CAE AER ERV RVE VED EDG DGQ GQK QKL KLL LLF	CAS ASG SGF GFG FGT GTV TVN VNE NEQ EQF QFF	AVFDRKSDAK
33980	CAM AMS MSG SGD GDG DGG GGS GSQ SQG QGN GNL NLI LIF	CAS ASS SST STR TRS RSA SAY AYE YEQ EQY QYF	GILGFVFTL
21422	CAA AAR ARV RVR VRG RGF GFG FGN GNV NVL VLH LHC	CAS ASS SSL SLR LRD RDG DGS GSE SEA EAF AFF	RAKFKQLL
31459	CIL ILS LSI SIQ IQG QGG GGS GSE SEK EKL KLV LVF	CAS ASS SSP SPR PRS RSS SSQ SQP QPQ PQH QHF	GILGFVFTL
5774	CGT GTA TAD ADG DGG GGS GSQ SQG QGN GNL NLI LIF	CAS ASS SSI SIR IRS RSD SDD DDI DIQ IQY QYF	GILGFVFTL
36054	CAV AVD VDN DNA NAR ARL RLM LMF	CAS ASS SSF SFD FDQ DQT QTN TNQ NQP QPQ PQH QHF	ELAGIGILTV
34510	CAE AES ESM SMD MDS DSS SSY SYK YKL KLI LIF	CAS ASS SSY SYT YTG TGG GGD GDT DTE TEA EAF AFF	AVFDRKSDAK
644	CVV VVS VSA SAN ANS NSD SDG DGQ GQK QKL KLL LLF	CAS ASS SSV SVV VVS VSG SGA GAN ANV NVL VLT LTF	KLGGALQAK
35709	CAV AVI VIY IYS YSG SGY GYA YAL ALN LNF	CAS AST STP TPG PGQ GQE QEI EIY IYG YGY GYT YTF	KLGGALQAK
31681	CAF AFQ FQN QNQ NQG QGG GGK GKL KLI LIF	CAS ASS SST STR TRS RSS SSE SET ETQ TQY QYF	GILGFVFTL
35105	CAV AVR VRM RMY MYS YSG SGG GGG GGA GAD ADG DGL GLT LTF	CAS ASR SRS RSR SRE RER ERG RGD GDE DEA EAF AFF	KLGGALQAK
6349	CAV AVG VGR GRS RSY SYS YSG SGA GAG AGS GSY SYQ YQL QLT LTF	CAS ASS SST STR TRS RSG SGT GTE TEA EAF AFF	GILGFVFTL
31624	CIL ILR LRD RDV DVG VGT GTG TGT GTA TAS ASK SKL KLT LTF	CAS ASS SSS SSR SRS RSG SGY GYE YEQ EQY QYF	GILGFVFTL
27085	CAA AAS ASE SET ETS TSY SYD YDK DKV KVI VIF	CSV SVE VED EDR DRR RRP RPD PDE DEQ EQF QFF	RAKFKQLL
31850	CAG AGR GRG RGN GNN NNA NAR ARL RLM LMF	CAS ASS SST STT TTS TSG SGG GGL GLN LNE NEQ EQF QFF	GILGFVFTL
25762	CAV AVA VAK AKD KDL DLQ LQN QNS NSG SGG GGG GGA GAD ADG DGL GLT LTF	CAS ASS SSQ SQD QDP DPS PSR SRT RTY TYE YEQ EQY QYF	GILGFVFTL
38432	CAP APS PSG SGY GYS YST STL TLT LTF	CAS ASS SSA SAE AEG EGA GAG AGN GNM NMN MNT NTE TEA EAF AFF	KLGGALQAK
35139	CAV AVP VPD PDS DSN SNY NYQ YQL QLI LIW	CAS ASS SSF SFA FAG AGG GGG GGG GGY GYT YTF	KLGGALQAK
36010	CAL ALD LDF DFS FSS SSG SGS GSA SAR ARQ RQL QLT LTF	CAS ASS SSQ SQG QGP GPG PGT GTV TVH VHE HEK EKL KLF LFF	KLGGALQAK
34415	CAV AVQ VQA QAH AHS HSG SGG GGG GGA GAD ADG DGL GLT LTF	CAS ASS SSV SVG VGS GSG SGN GNT NTI TIY IYF	KLGGALQAK
22089	CAA AAA AAE AET ETS TSY SYD YDK DKV KVI VIF	CAS ASS SSL SLR LRD RDG DGS GSE SEA EAF AFF	RAKFKQLL
25298	CAE AEG EGE GET ETS TSY SYD YDK DKV KVI VIF	CAS ASS SSF SFT FTG TGG GGT GTG TGE GEL ELF LFF	RAKFKQLL
28416	CAF AFM FMR MRP RPN PNN NNA NAR ARL RLM LMF	CAS ASS SSS SSR SRT RTS TSG SGG GGA GAG AGQ GQF QFF	KLGGALQAK
6604	CAA AAA AAQ AQE QET ETS TSG SGS GSR SRL RLT LTF	CAS ASS SSI SIE IEG EGG GGT GTT TTE TEA EAF AFF	KLGGALQAK
36152	CIT ITG TGG GGG GGA GAD ADG DGL GLT LTF	CAT ATS TSR SRD RDR DRL RLG LGR GRG RGK GKG KGT GTE TEA EAF AFF	KLGGALQAK
7243	CAM AMT MTR TRS RSN SNT NTG TGN GNQ NQF QFY FYF	CAS ASS SSG SGR GRH RHV HVD VDT DTK TKD KDT DTQ TQY QYF	IVTDFSVIK
29924	CAE AEN ENT NTG TGG GGG GGS GSQ SQG QGN GNL NLI LIF	CAS ASS SSF SFR FRS RSS SSE SEK EKL KLF LFF	GILGFVFTL
34490	CAM AMR MRE REG EGW GWG WGG GGG GGA GAD ADG DGL GLT LTF	CAS ASS SSL SLW LWT WTG TGT GTE TET ETQ TQY QYF	KLGGALQAK
30719	CIF IFV FVR VRN RNR NRD RDD DDK DKI KII IIF	CAS ASS SSI SIR IRS RSS SSY SYE YEQ EQY QYF	GILGFVFTL
32362	CAG AGA GAG AGS GSQ SQG QGN GNL NLI LIF	CAS ASS SSI SIG IGL GLY LYG YGY GYT YTF	GILGFVFTL
7168	CAE AEN ENM NMG MGG GGG GGS GSQ SQG QGN GNL NLI LIF	CAS ASS SSS SSR SRS RSG SGE GET ETQ TQY QYF	GILGFVFTL
27079	CAM AMR MRE REY EYN YNF NFN FNK NKF KFY FYF	CSV SVA VAG AGT GTS TSG SGG GGA GAY AYE YEQ EQY QYF	KLGGALQAK
35113	CAM AMT MTR TRE REM EMN MNS NSG SGY GYS YST STL TLT LTF	CAS ASS SSL SLE LEP EPS PSY SYE YEQ EQY QYF	KLGGALQAK
18092	CAV AVN VNM NME MEV EVS VSR SRG RGG GGG GGA GAD ADG DGL GLT LTF	CAS AST STL TLG LGG GGL GLG LGQ GQP QPQ PQH QHF	ELAGIGILTV
23904	CAD ADS DSG SGG GGG GGA GAD ADG DGL GLT LTF	CAS ASS SSQ SQQ QQG QGQ GQP QPQ PQE QET ETQ TQY QYF	RAKFKQLL
27100	CAA AAF AFN FNS NSG SGG GGS GSN SNY NYK YKL KLT LTF	CSV SVG VGQ GQG QGM GMN MNT NTE TEA EAF AFF	RAKFKQLL
34713	CAL ALS LSE SEF EFL FLT LTG TGG GGF GFK FKT KTI TIF	CAS ASW SWT WTG TGT GTS TSA SAE AED EDY DYN YNE NEQ EQF QFF	KLGGALQAK
149	CAV AVP VPK PKV KVD VDS DSN SNY NYQ YQL QLI LIW	CAS ASS SSQ SQA QAQ AQA QAS ASS SSY SYE YEQ EQY QYF	KLGGALQAK
18220	CAA AAS ASE SET ETS TSY SYD YDK DKV KVI VIF	CAS ASS SSL SLR LRD RDG DGS GSE SEA EAF AFF	RAKFKQLL
15310	CAL ALV LVD VDS DSN SNY NYQ YQL QLI LIW	CAS ASS SSQ SQD QDG DGR GRG RGG GGY GYG YGY GYT YTF	KLGGALQAK
245	CAL ALG LGE GEG EGN GNN NNQ NQG QGG GGK GKL KLI LIF	CAS ASS SSA SAS ASG SGA GAR ARD RDY DYS YSN SNQ NQP QPQ PQH QHF	KLGGALQAK
2477	CAV AVG VGD GDN DNF NFN FNK NKF KFY FYF	CAS ASS SSE SER ERD RDP DPY PYE YEQ EQY QYF	AVFDRKSDAK
2481	CAV AVG VGA GAS ASG SGG GGS GSY SYI YIP IPT PTF	CAA AAG AGG GGG GGG GGT GTE TEK EKL KLF LFF	KLGGALQAK
24714	CAA AAW AWE WEG EGT GTG TGR GRR RRA RAL ALT LTF	CAS ASS SSL SLG LGG GGG GGL GLG LGN GNE NEQ EQF QFF	KLGGALQAK
15985	CAA AAR ARV RVR VRG RGF GFG FGN GNV NVL VLH LHC	CAS AST STP TPI PIE IES ESS SST STD TDT DTQ TQY QYF	KLGGALQAK
34427	CAV AVS VSG SGN GND NDY DYK YKL KLS LSF	CAS AST STV TVS VSG SGE GEP EPS PST STD TDT DTQ TQY QYF	KLGGALQAK
34390	CAM AMS MSY SYA YAT ATD TDS DSW SWG WGK GKL KLQ LQF	CAS ASS SST STR TRG RGL GLA LAE AEE EEQ EQF QFF	KLGGALQAK
2333	CAV AVN VNL NLA LAG AGG GGT GTS TSY SYG YGK GKL KLT LTF	CAS ASS SSF SFA FAP APG PGN GNT NTI TIY IYF	ELAGIGILTV
33814	CAI AIT ITY TYG YGG GGS GSQ SQG QGN GNL NLI LIF	CAS ASS SST STR TRS RST STD TDT DTQ TQY QYF	GILGFVFTL
25353	CAA AAS ASE SET ETS TSY SYD YDK DKV KVI VIF	CAS ASS SSF SFV FVD VDR DRV RVY VYE YEQ EQY QYF	RAKFKQLL
27097	CAT ATD TDS DSG SGG GGS GSN SNY NYK YKL KLT LTF	CSV SVG VGA GAG AGE GED EDD DDE DEQ EQY QYF	RAKFKQLL
24312	CVV VVT VTA TAG AGN GNT NTG TGK GKL KLI LIF	CAS ASS SSR SRD RDS DSA SAS AST STG TGE GEL ELF LFF	KLGGALQAK
34611	CAV AVD VDS DSN SNY NYQ YQL QLI LIW	CAS ASS SSF SFR FRA RAF AFF	KLGGALQAK
17996	CGT GTE TEY EYP YPN PND NDY DYK YKL KLS LSF	CAS ASS SSV SVE VEG EGV GVG VGT GTS TST STD TDT DTQ TQY QYF	GLCTLVAML
2244	CAV AVG VGA GAG AGG GGY GYN YNK NKL KLI LIF	CAS ASS SSG SGT GTG TGA GAN ANY NYG YGY GYT YTF	KLGGALQAK
35986	CAY AYR YRS RSN SNR NRD RDD DDK DKI KII IIF	CAS ASS SSE SEW EWA WAR ARG RGR GRG RGR GRY RYT YTG TGE GEL ELF LFF	KLGGALQAK
15184	CAG AGG GGG GGS GSQ SQG QGN GNL NLI LIF	CAS ASS SSL SLL LLW LWA WAE AEY EYN YNE NEQ EQF QFF	RAKFKQLL
5164	CAV AVP VPT PTR TRS RSG SGA GAN ANN NNL NLF LFF	CSA SAR ARD RDP DPP PPS PSD SDV DVG VGT GTQ TQY QYF	IVTDFSVIK
32394	CAY AYS YSL SLS LSA SAG AGG GGT GTS TSY SYG YGK GKL KLT LTF	CAS ASS SSI SIG IGV GVY VYG YGY GYT YTF	GILGFVFTL
91	CAL ALR LRP RPS PSN SND NDY DYK YKL KLS LSF	CAS ASS SSP SPG PGQ GQG QGI GIH IHG HGY GYT YTF	KLGGALQAK
624	CAM AMS MSG SGH GHN HNQ NQG QGG GGK GKL KLI LIF	CAS ASS SSV SVD VDG DGK GKT KTE TEQ EQY QYF	KLGGALQAK
35220	CVV VVS VSR SRG RGN GNN NNN NNA NAR ARL RLM LMF	CAS ASS SSG SGS GSG SGG GGS GST STD TDT DTQ TQY QYF	KLGGALQAK
21756	CAM AMR MRS RST STG TGN GNQ NQF QFY FYF	CAS ASS SSL SLR LRD RDG DGS GSE SEA EAF AFF	RAKFKQLL
33909	CAG AGA GAV AVG VGS GSS SSN SNT NTG TGK GKL KLI LIF	CAS ASS SSD SDP DPG PGI GIQ IQE QET ETQ TQY QYF	GILGFVFTL
36176	CAY AYE YEG EGG GGA GAQ AQK QKL KLV LVF	CAS ASS SSL SLF LFS FSG SGL GLA LAD ADE DEQ EQF QFF	KLGGALQAK
34458	CAD ADE DEL ELV LVF	CAS ASR SRQ RQI QIL ILA LAA AAN ANT NTD TDT DTQ TQY QYF	KLGGALQAK
32252	CAV AVN VNQ NQG QGA GAQ AQK QKL KLV LVF	CAS ASS SSG SGR GRS RSG SGE GET ETQ TQY QYF	GILGFVFTL
5136	CAA AAD ADD DDG DGR GRL RLM LMF	CAW AWT WTG TGT GTG TGK GKI KIG IGW GWD WDS DSP SPL PLH LHF	RAKFKQLL
684	CAV AVG VGD GDN DNF NFN FNK NKF KFY FYF	CAS ASS SSL SLR LRS RSA SAA AAG AGW GWP WPF PFF	AVFDRKSDAK
32322	CAV AVN VNP NPL PLE LEG EGN GNT NTG TGK GKL KLI LIF	CAS ASS SSH SHL HLL LLS LST STV TVD VDY DYE YEQ EQY QYF	KLGGALQAK
34364	CAL ALS LSE SEN ENA NAG AGG GGT GTS TSY SYG YGK GKL KLT LTF	CAS ASS SSF SFT FTS TSG SGG GGY GYE YEQ EQY QYF	KLGGALQAK
2449	CAL ALQ LQG QGG GGS GSE SEK EKL KLV LVF	CAS ASS SSL SLV LVG VGV GVG VGG GGS GSG SGN GNT NTI TIY IYF	KLGGALQAK
35876	CAD ADN DNY NYG YGG GGS GSQ SQG QGN GNL NLI LIF	CAS ASS SSI SIS ISG SGQ GQG QGT GTD TDT DTQ TQY QYF	KLGGALQAK
38418	CAT ATD TDA DAF AFN FNA NAG AGG GGT GTS TSY SYG YGK GKL KLT LTF	CAS ASS SSY SYF YFR FRS RSG SGA GAL ALY LYN YNE NEQ EQF QFF	KLGGALQAK
2409	CAY AYS YSP SPA PAA AAG AGG GGT GTS TSY SYG YGK GKL KLT LTF	CAS ASS SSL SLG LGQ GQQ QQA QAK AKN KNI NIQ IQY QYF	GILGFVFTL
35634	CVV VVS VSY SYN YNT NTD TDK DKL KLI LIF	CAS ASS SSP SPL PLG LGG GGR GRT RTE TEA EAF AFF	KLGGALQAK
34929	CAG AGG GGG GGA GAG AGN GNM NML MLT LTF	CAI AIR IRT RTT TTP TPP PPG PGH GHS HST STD TDT DTQ TQY QYF	KLGGALQAK
34288	CAE AER ERA RAR ARS RSG SGG GGG GGA GAD ADG DGL GLT LTF	CAS ASS SSR SRT RTH THG HGT GTG TGK GKG KGY GYT YTF	KLGGALQAK
28684	CIL ILR LRD RDL DLN LNA NAG AGG GGT GTS TSY SYG YGK GKL KLT LTF	CAS ASS SSE SEV EVV VVS VST STT TTY TYE YEQ EQY QYF	KLGGALQAK
35035	CAV AVS VSD SDP DPS PSG SGT GTS TSY SYD YDK DKV KVI VIF	CAS ASR SRR RRT RTG TGG GGE GER ERS RSE SEA EAF AFF	KLGGALQAK
5231	CAE AET ETL TLA LAP APG PGG GGS GSY SYI YIP IPT PTF	CSA SAL ALG LGG GGT GTQ TQY QYF	GILGFVFTL
532	CAA AAT ATN TNS NSN SNS NSG SGY GYA YAL ALN LNF	CAS ASS SSL SLS LSS SSG SGT GTY TYE YEQ EQY QYF	IVTDFSVIK
35931	CAT ATV TVT VTR TRN RNR NRD RDD DDK DKI KII IIF	CAS ASS SSS SSG SGT GTG TGD GDV DVY VYE YEQ EQY QYF	KLGGALQAK
5517	CAA AAS ASA SAP APS PSG SGN GNT NTP TPL PLV LVF	CAS ASS SSQ SQW QWG WGL GLA LAG AGE GED EDT DTQ TQY QYF	KLGGALQAK
35660	CAF AFR FRG RGS GSQ SQG QGN GNL NLI LIF	CAS ASS SSY SYS YSI SIG IGN GNQ NQP QPQ PQH QHF	KLGGALQAK
5533	CAV AVP VPI PIT ITG TGG GGG GGN GNK NKL KLT LTF	CAS ASS SSY SYS YSS SSF SFG FGT GTD TDT DTQ TQY QYF	ELAGIGILTV
2511	CAM AMR MRE RES ESS SSG SGY GYS YST STL TLT LTF	CAI AIS ISL SLT LTL TLL LLG LGQ GQR QRD RDQ DQE QET ETQ TQY QYF	RAKFKQLL
5319	CAA AAR ARV RVR VRG RGF GFG FGN GNV NVL VLH LHC	CAS ASS SSL SLG LGL GLA LAG AGG GGQ GQE QET ETQ TQY QYF	AVFDRKSDAK
34711	CAV AVS VSD SDQ DQN QNS NSG SGG GGS GSN SNY NYK YKL KLT LTF	CAS AST STP TPR PRR RRT RTL TLE LEQ EQF QFF	KLGGALQAK
5317	CAM AMR MRE REG EGP GPT PTM TMN MNT NTG TGF GFQ FQK QKL KLV LVF	CAS ASS SSG SGG GGT GTG TGG GGT GTS TSG SGS GSL SLR LRE REQ EQF QFF	KLGGALQAK
34773	CVV VVS VSA SAR ARG RGG GGA GAD ADG DGL GLT LTF	CAS ASS SSL SLP LPL PLA LAG AGG GGS GST STD TDT DTQ TQY QYF	KLGGALQAK
86	CVV VVL VLG LGV GVM VMD MDS DSN SNY NYQ YQL QLI LIW	CAS ASS SSL SLD LDP DPG PGQ GQG QGW GWT WTN TNT NTE TEA EAF AFF	GILGFVFTL
19413	CAG AGR GRE REL ELE LEA EAG AGG GGT GTS TSY SYG YGK GKL KLT LTF	CAS ASS SSL SLR LRD RDG DGS GSE SEA EAF AFF	RAKFKQLL
19210	CGT GTD TDK DKG KGG GGG GGY GYQ YQK QKV KVT VTF	CAS ASS SSL SLR LRD RDG DGS GSE SEA EAF AFF	RAKFKQLL
18064	CGT GTE TEY EYP YPN PND NDY DYK YKL KLS LSF	CAS ASS SSF SFL FLA LAG AGT GTD TDT DTQ TQY QYF	GLCTLVAML
33891	CAT ATA TAR ARS RSS SSM SMD MDS DSN SNY NYQ YQL QLI LIW	CAT ATA TAP APH PHS HSG SGN GNQ NQP QPQ PQH QHF	GILGFVFTL
34880	CAF AFL FLG LGS GSG SGN GNF NFN FNK NKF KFY FYF	CAS ASS SSD SDL DLE LEP EPQ PQE QET ETQ TQY QYF	KLGGALQAK
5806	CAL ALT LTG TGN GNY NYG YGQ GQN QNF NFV FVF	CAS ASS SSI SIR IRS RSS SSY SYE YEQ EQY QYF	GILGFVFTL
16963	CAV AVR VRD RDS DSA SAG AGT GTA TAL ALI LIF	CAS ASS SSL SLG LGT GTG TGG GGS GSY SYE YEQ EQY QYF	KLGGALQAK
36085	CVV VVT VTG TGN GNQ NQF QFY FYF	CAS ASS SSQ SQY QYH YHV HVE VEG EGS GST STE TEA EAF AFF	KLGGALQAK
31924	CAG AGP GPQ PQD QDG DGG GGS GSQ SQG QGN GNL NLI LIF	CAS ASS SSY SYY YYS YSN SNQ NQP QPQ PQH QHF	GILGFVFTL
35350	CAV AVI VIN INA NAR ARL RLM LMF	CSA SAP APT PTG TGG GGG GGL GLY LYN YNE NEQ EQF QFF	KLGGALQAK
34985	CAV AVG VGR GRN RNN NNN NNA NAR ARL RLM LMF	CAS ASS SSL SLI LIG IGG GGA GAN ANE NEQ EQF QFF	KLGGALQAK
2293	CAV AVS VSQ SQW QWA WAQ AQK QKL KLV LVF	CAS ASS SSL SLG LGL GLA LAG AGL GLN LNE NEQ EQF QFF	KLGGALQAK
28676	CAV AVD VDN DNF NFG FGN GNE NEK EKL KLT LTF	CAS ASS SSE SEG EGT GTG TGG GGT GTE TEA EAF AFF	KLGGALQAK
28877	CAG AGA GAG AGD GDG DGG GGS GSQ SQG QGN GNL NLI LIF	CAS ASS SSY SYS YSS SSG SGG GGA GAD ADT DTQ TQY QYF	GILGFVFTL
36200	CAI AIN INQ NQG QGG GGG GGA GAT ATN TNK NKL KLI LIF	CAS ASS SSP SPG PGR GRT RTG TGE GEL ELF LFF	KLGGALQAK
31655	CAV AVS VSG SGD GDG DGG GGS GSQ SQG QGN GNL NLI LIF	CAS ASS SST STR TRS RSA SAY AYE YEQ EQY QYF	GILGFVFTL
6259	CAG AGS GSS SSG SGG GGS GSQ SQG QGN GNL NLI LIF	CAS ASS SSP SPR PRS RST STD TDT DTQ TQY QYF	GILGFVFTL
31555	CAD ADE DES ESG SGG GGS GSQ SQG QGN GNL NLI LIF	CAS ASS SSS SSQ SQG QGA GAN ANE NEK EKL KLF LFF	RAKFKQLL
28734	CAG AGT GTA TAG AGN GNQ NQF QFY FYF	CAS ASL SLR LRD RDG DGE GEL ELF LFF	KLGGALQAK
5191	CAM AMN MNP NPA PAW AWG WGG GGA GAT ATN TNK NKL KLI LIF	CSA SAS ASP SPG PGD GDY DYE YEQ EQY QYF	KLGGALQAK
34993	CAA AAV AVP VPS PSG SGS GSA SAR ARQ RQL QLT LTF	CAS ASS SSP SPF PFY FYM YME MET ETQ TQY QYF	KLGGALQAK
8151	CVG VGY GYT YTN TNA NAG AGK GKS KST STF	CAS ASS SSF SFS FSG SGN GNT NTG TGE GEL ELF LFF	RAKFKQLL
33016	CAL ALS LSE SEG EGV GVG VGK GKL KLI LIF	CAS ASS SSI SIR IRS RSS SSY SYE YEQ EQY QYF	GILGFVFTL
35646	CAL ALG LGN GNS NSG SGN GNT NTP TPL PLV LVF	CAS ASS SSS SSW SWN WNT NTE TEA EAF AFF	KLGGALQAK
5249	CEI EIV IVN VNY NYG YGG GGA GAT ATN TNK NKL KLI LIF	CSA SAR ARG RGM GME MER ERE REA EAL ALE LET ETQ TQY QYF	KLGGALQAK
30399	CAG AGP GPA PAE AEV EVS VSG SGG GGS GSQ SQG QGN GNL NLI LIF	CAS ASS SSI SII IIA IAL ALD LDT DTQ TQY QYF	GILGFVFTL
35940	CAV AVS VSD SDR DRD RDY DYG YGQ GQN QNF NFV FVF	CAS ASS SST STT TTS TSG SGG GGL GLD LDT DTQ TQY QYF	KLGGALQAK
28724	CAY AYR YRI RIS ISL SLN LNN NNN NND NDM DMR MRF	CAS ASS SSD SDP DPS PSF SFF FFL FLT LTN TNT NTE TEA EAF AFF	GILGFVFTL
27119	CAT ATD TDA DAK AKG KGG GGS GSN SNY NYK YKL KLT LTF	CSV SVG VGS GSG SGD GDG DGG GGE GEQ EQF QFF	RAKFKQLL
4939	CAE AEG EGG GGG GGS GSQ SQG QGN GNL NLI LIF	CAS ASS SSL SLA LAG AGL GLA LAG AGG GGE GEL ELF LFF	ELAGIGILTV
6348	CAS ASA SAG AGS GSG SGN GNT NTG TGK GKL KLI LIF	CAS ASS SST STR TRS RSG SGT GTE TEA EAF AFF	GILGFVFTL
13987	CAV AVA VAG AGY GYS YST STL TLT LTF	CAS ASS SSP SPT PTS TSN SNE NEQ EQF QFF	KLGGALQAK
30413	CAL ALK LKA KAG AGT GTA TAL ALI LIF	CAS ASS SSI SIR IRA RAS ASY SYE YEQ EQY QYF	GILGFVFTL
36067	CAL ALS LSE SEA EAF AFT FTG TGG GGG GGN GNK NKL KLT LTF	CAS ASS SST STL TLT LTI TIA IAT ATL TLD LDN DNE NEQ EQF QFF	KLGGALQAK
17995	CAA AAS ASG SGQ GQN QNT NTD TDK DKL KLI LIF	CAS ASS SSV SVE VEA EAV AVP VPE PET ETQ TQY QYF	KLGGALQAK
30524	CAG AGS GSG SGS GSQ SQG QGN GNL NLI LIF	CAS ASS SSI SIR IRS RSS SSY SYE YEQ EQY QYF	GILGFVFTL
26060	CAT ATD TDG DGG GGN GNN NNA NAR ARL RLM LMF	CAW AWS WSW SWG WGS GSG SGG GGE GEQ EQY QYF	KLGGALQAK
35218	CAT ATT TTN TND NDY DYK YKL KLS LSF	CAS ASS SSG SGA GAL ALQ LQD QDS DSN SNQ NQP QPQ PQH QHF	KLGGALQAK
28835	CGA GAA AAG AGN GNM NML MLT LTF	CAS ASG SGM GMT MTG TGL GLT LTS TSE SEQ EQY QYF	KLGGALQAK
3897	CAV AVS VSQ SQD QDS DSN SNY NYQ YQL QLI LIW	CAS ASS SSW SWG WGG GGG GGS GSH SHY HYG YGY GYT YTF	IVTDFSVIK
23017	CAE AEV EVF	CAS ASS SSL SLG LGG GGG GGN GNN NNE NEQ EQF QFF	IVTDFSVIK
24311	CAA AAH AHR HRV RVD VDS DSG SGA GAG AGS GSY SYQ YQL QLT LTF	CAS ASS SSR SRD RDL DLS LSG SGA GAN ANV NVL VLT LTF	KLGGALQAK
34338	CAP APP PPA PAR ARY RYG YGK GKL KLT LTF	CAS ASS SSQ SQQ QQG QGG GGW GWT WTE TEA EAF AFF	KLGGALQAK
3646	CAG AGG GGN GNT NTG TGK GKL KLI LIF	CAS ASS SSW SWG WGG GGG GGS GSH SHY HYG YGY GYT YTF	IVTDFSVIK
34514	CAV AVG VGG GGD GDS DSG SGG GGY GYQ YQK QKV KVT VTF	CAS ASS SSD SDW DWG WGL GLS LSY SYE YEQ EQY QYV	KLGGALQAK
25409	CAA AAS ASE SET ETS TSY SYD YDK DKV KVI VIF	CAS ASS SSL SLL LLD LDS DSP SPG PGG GGY GYG YGY GYT YTF	RAKFKQLL
34091	CAV AVG VGD GDG DGS GSG SGT GTY TYK YKY KYI YIF	CAS ASS SSP SPP PPG PGA GAD ADP DPY PYN YNE NEQ EQF QFF	KLGGALQAK
5092	CAM AMR MRG RGL GLI LIQ IQG QGA GAQ AQK QKL KLV LVF	CAS ASS SSS SSA SAG AGT GTG TGG GGQ GQE QET ETQ TQY QYF	KLGGALQAK
18008	CIL ILW LWV WVA VAA AAG AGN GNK NKL KLT LTF	CAS ASS SSV SVR VRS RSS SSM SMN MNT NTE TEA EAF AFF	KLGGALQAK
31268	CAA AAS ASM SMG MGG GGG GGS GSQ SQG QGN GNL NLI LIF	CAS ASS SSI SIR IRS RST STD TDT DTQ TQY QYF	GILGFVFTL
35138	CAM AMR MRL RLP LPG PGG GGK GKL KLI LIF	CAS ASS SSE SEG EGL GLG LGT GTE TEA EAF AFF	KLGGALQAK
34451	CAL ALN LNG NGG GGS GSQ SQG QGN GNL NLI LIF	CAT ATG TGG GGS GSG SGN GNI NIQ IQY QYF	KLGGALQAK
6366	CAG AGA GAD ADG DGS GSG SGN GNT NTG TGK GKL KLI LIF	CAS ASS SSV SVR VRS RSA SAY AYE YEQ EQY QYF	GILGFVFTL
28715	CAL ALR LRP RPA PAV AVG VGN GNQ NQG QGG GGK GKL KLI LIF	CAS ASS SSP SPN PNG NGG GGA GAP APS PSY SYE YEQ EQY QYF	KLGGALQAK
6569	CAG AGH GHS HSG SGG GGG GGA GAD ADG DGL GLT LTF	CAS ASR SRL RLV LVS VSM SMN MNT NTE TEA EAF AFF	KLGGALQAK
36300	CAM AME MEG EGG GGY GYQ YQK QKV KVT VTF	CSV SVS VSW SWD WDE DEG EGY GYE YEQ EQY QYF	KLGGALQAK
7087	CAL ALS LSE SEV EVM VMD MDT DTG TGR GRR RRA RAL ALT LTF	CAS ASS SSP SPR PRT RTD TDL DLS LSA SAP APN PNT NTG TGE GEL ELF LFF	RAKFKQLL
35001	CAP APY PYS YSG SGA GAN ANS NSK SKL KLT LTF	CAS ASS SSS SSG SGT GTR TRP RPT PTE TEQ EQY QYV	KLGGALQAK
5380	CAV AVS VSM SMD MDG DGL GLM LMF	CAS ASS SSG SGT GTQ TQP QPG PGL GLG LGG GGE GEQ EQF QFF	ELAGIGILTV
33596	CAY AYP YPV PVY VYN YNF NFN FNK NKF KFY FYF	CAS ASS SST STI TIG IGT GTG TGG GGL GLE LEK EKL KLF LFF	KLGGALQAK
154	CAE AER ERP RPL PLW LWA WAG AGG GGF GFK FKT KTI TIF	CAS ASS SSQ SQE QED EDS DSS SSY SYN YNE NEQ EQF QFF	KLGGALQAK
7693	CAT ATD TDS DSY SYG YGQ GQN QNF NFV FVF	CAS ASS SSF SFG FGI GID IDS DSP SPL PLH LHF	KLGGALQAK
12586	CAM AMK MKS KST STN TNA NAG AGK GKS KST STF	CAS ASS SSF SFS FSG SGN GNT NTG TGE GEL ELF LFF	RAKFKQLL
5506	CAV AVR VRE RET ETG TGA GAN ANN NNL NLF LFF	CAS ASR SRT RTG TGG GGF GFE FEA EAF AFF	GILGFVFTL
34863	CAT ATA TAR ARL RLR LRD RDD DDK DKI KII IIF	CAS ASS SSP SPT PTG TGP GPN PNT NTE TEA EAF AFF	KLGGALQAK
14319	CAL ALS LSK SKM KMD MDS DSS SSY SYK YKL KLI LIF	CAS ASS SSL SLP LPP PPR PRS RSG SGA GAA AAY AYN YNE NEQ EQF QFF	KLGGALQAK
6078	CAV AVV VVE VEG EGG GGG GGS GSQ SQG QGN GNL NLI LIF	CAS ASS SSI SIR IRS RSS SSY SYE YEQ EQY QYF	GILGFVFTL
17862	CAT ATD TDA DAG AGI GIL ILS LSG SGT GTY TYK YKY KYI YIF	CAS ASS SSV SVR VRV RVG VGS GSP SPL PLH LHF	KLGGALQAK
7091	CAV AVA VAV AVG VGV GVS VSG SGG GGG GGA GAD ADG DGL GLT LTF	CAS ASS SSQ SQG QGA GAY AYG YGY GYT YTF	GILGFVFTL
36314	CAV AVM VMD MDS DSS SSY SYK YKL KLI LIF	CAS ASS SSD SDG DGT GTG TGG GGY GYN YNE NEQ EQF QFF	KLGGALQAK
34166	CIV IVR VRD RDH DHN HNY NYG YGQ GQN QNF NFV FVF	CAS ASS SSQ SQD QDF DFS FSG SGA GAI AIM IMN MNT NTE TEA EAF AFF	KLGGALQAK
23852	CVV VVS VSG SGL GLT LTG TGG GGG GGN GNK NKL KLT LTF	CAS ASS SSL SLE LER ERG RGS GSY SYN YNE NEQ EQF QFF	KLGGALQAK
23823	CAT ATG TGY GYN YNN NNA NAG AGN GNM NML MLT LTF	CAS ASS SSS SSS SSG SGQ GQT QTY TYG YGY GYT YTF	KLGGALQAK
24986	CLV LVG VGD GDI DIR IRT RTG TGA GAN ANN NNL NLF LFF	CAS ASS SSL SLV LVF VFT FTG TGG GGA GAG AGN GNE NEQ EQF QFF	KLGGALQAK
24713	CAL ALG LGD GDR DRG RGN GNQ NQF QFY FYF	CAS ASS SSL SLG LGG GGG GGI GIG IGT GTD TDT DTQ TQY QYF	KLGGALQAK
32695	CAT ATN TNY NYG YGG GGS GSQ SQG QGN GNL NLI LIF	CAS ASS SSI SIR IRS RSS SSY SYE YEQ EQY QYF	GILGFVFTL
14270	CAV AVF VFL FLY LYG YGN GNN NNR NRL RLA LAF	CAS ASS SSP SPS PSS SSS SSY SYE YEQ EQY QYF	RAKFKQLL
8008	CAG AGN GNR NRD RDD DDK DKI KII IIF	CAS ASS SSF SFL FLD LDR DRG RGP GPN PNT NTE TEA EAF AFF	RAKFKQLL
28881	CAD ADS DSG SGG GGG GGA GAD ADG DGL GLT LTF	CAS ASS SSF SFP FPG PGG GGF GFT FTG TGE GEL ELF LFF	RAKFKQLL
28730	CAG AGQ GQD QDS DSN SNY NYQ YQL QLI LIW	CAT ATS TSP SPS PSG SGG GGT GTY TYN YNE NEQ EQF QFF	KLGGALQAK
25808	CIL ILR LRE RET ETS TSY SYD YDK DKV KVI VIF	CAS ASS SSS SSG SGL GLA LAG AGV GVN VNE NEQ EQF QFF	RAKFKQLL
2404	CVV VVS VSD SDY DYR YRD RDD DDK DKI KII IIF	CAS AST STQ TQN QNR NRE REN ENT NTE TEA EAF AFF	KLGGALQAK
36119	CGG GGS GSN SNY NYK YKL KLT LTF	CAS ASS SSV SVD VDE DEQ EQF QFS FSY SYE YEQ EQY QYF	KLGGALQAK
2273	CAY AYR YRS RSG SGN GNN NNN NND NDM DMR MRF	CAS ASS SSL SLL LLN LNQ NQP QPQ PQH QHF	KLGGALQAK
35334	CAG AGR GRV RVS VSG SGS GSA SAR ARQ RQL QLT LTF	CAW AWS WSV SVG VGA GAG AGS GSN SNE NEQ EQY QYV	KLGGALQAK
40	CAL ALD LDR DRA RAG AGN GNN NNR NRK RKL KLI LIW	CAS ASS SSY SYR YRV RVD VDS DSN SNQ NQP QPQ PQH QHF	GILGFVFTL
34155	CGA GAD ADI DII IIF IFR FRD RDT DTG TGN GNQ NQF QFY FYF	CAS ASS SSP SPG PGQ GQG QGT GTH THY HYE YEQ EQY QYV	KLGGALQAK
2455	CAV AVR VRV RVG VGS GSG SGG GGY GYN YNK NKL KLI LIF	CAS ASS SSP SPR PRT RTD TDA DAE AER ERA RAK AKN KNI NIQ IQY QYF	RAKFKQLL
36271	CAV AVN VNP NPG PGG GGY GYN YNK NKL KLI LIF	CSA SAG AGL GLE LEN ENS NSG SGG GGA GAW AWN WNE NEQ EQF QFF	KLGGALQAK
34767	CAL ALS LSE SED EDG DGQ GQG QGA GAQ AQK QKL KLV LVF	CAS ASS SSL SLG LGW GWG WGA GAK AKN KNI NIQ IQY QYF	KLGGALQAK
2837	CGT GTE TEY EYP YPN PND NDY DYK YKL KLS LSF	CAS ASS SSW SWG WGG GGG GGS GSH SHY HYG YGY GYT YTF	IVTDFSVIK
35058	CAV AVD VDV DVT VTG TGA GAG AGS GSY SYQ YQL QLT LTF	CAS ASS SSL SLI LIE IEA EAS ASG SGG GGF GFE FEQ EQF QFF	KLGGALQAK
36155	CAV AVD VDL DLM LMK MKT KTS TSY SYD YDK DKV KVI VIF	CAS ASG SGD GDR DRG RGW GWD WDQ DQP QPQ PQH QHF	IVTDFSVIK
14678	CAV AVN VNL NLG LGG GGG GGS GSQ SQG QGN GNL NLI LIF	CAS ASS SSQ SQQ QQW QWE WEE EET ETQ TQY QYF	GILGFVFTL
22326	CAA AAS ASY SYP YPP PPY PYS YSS SSA SAS ASK SKI KII IIF	CAS ASS SSW SWG WGQ GQG QGK GKT KTG TGE GEL ELF LFF	RAKFKQLL
15992	CAV AVI VIG IGG GGS GSQ SQG QGN GNL NLI LIF	CAS ASS SSP SPN PNP NPG PGT GTN TNT NTG TGE GEL ELF LFF	KLGGALQAK
34084	CVG VGN GNN NNA NAG AGN GNM NML MLT LTF	CAS ASS SSP SPP PPP PPG PGV GVS VSM SMN MNT NTE TEA EAF AFF	KLGGALQAK
2530	CAM AMR MRE REG EGG GGE GEY EYG YGN GNK NKL KLV LVF	CAS ASS SSR SRA RAD ADL DLA LAG AGV GVP VPL PLG LGT GTG TGE GEL ELF LFF	KLGGALQAK
674	CAV AVN VNL NLP LPG PGT GTY TYK YKY KYI YIF	CAS ASS SSL SLG LGT GTG TGF GFG FGY GYT YTF	AVFDRKSDAK
6842	CAG AGP GPP PPG PGS GSS SSN SNT NTG TGK GKL KLI LIF	CAS ASS SSI SIR IRS RSS SSY SYE YEQ EQY QYF	GILGFVFTL
32547	CAG AGS GSG SGS GSQ SQG QGN GNL NLI LIF	CAS ASS SSI SIR IRS RSA SAY AYE YEQ EQY QYF	GILGFVFTL
6545	CAG AGP GPT PTH THN HNM NMN MNY NYG YGG GGS GSQ SQG QGN GNL NLI LIF	CAS ASS SSY SYY YYS YSN SNQ NQP QPQ PQH QHF	GILGFVFTL
25004	CAM AMS MSG SGD GDG DGG GGS GSQ SQG QGN GNL NLI LIF	CAS ASS SSW SWG WGG GGG GGS GSH SHY HYG YGY GYT YTF	IVTDFSVIK
35019	CAF AFM FMS MSL SLI LIQ IQG QGA GAQ AQK QKL KLV LVF	CAS ASS SSL SLE LEL ELG LGL GLA LAE AEA EAF AFF	KLGGALQAK
34978	CAV AVM VMP MPG PGS GSA SAR ARQ RQL QLT LTF	CAS ASS SSL SLF LFR FRS RSY SYE YEQ EQY QYF	KLGGALQAK
28876	CVV VVT VTE TET ETS TSY SYD YDK DKV KVI VIF	CAS ASS SSY SYS YSQ SQG QGG GGE GEG EGV GVD VDE DEQ EQF QFF	RAKFKQLL
35904	CIA IAR ARS RSG SGT GTY TYK YKY KYI YIF	CAS ASS SSM SMG MGS GSG SGQ GQS QSY SYG YGY GYT YTF	KLGGALQAK
34208	CAV AVR VRL RLA LAY AYN YNN NNN NND NDM DMR MRF	CAS ASS SSQ SQN QNT NTR TRT RTD TDG DGY GYT YTF	KLGGALQAK
34157	CAV AVD VDS DSG SGY GYS YST STL TLT LTF	CAS ASS SSP SPP PPD PDS DSY SYE YEQ EQY QYF	KLGGALQAK
